id,date,username,tweet
1354684883545690117,2021-01-28,timurdepok,Bhabinkamtibmas Kalurahan Maguwoharjo melaksanakan pengawalan pengambilan vaksin Covid-19 oleh petugas Puskesmas Depok 1 di Dinas kesehatan Kabupaten Sleman. . . #VaksinCovid-19 #TNIPOLRIdukungVaksinCovid-19  https://t.co/DbvvZ7nRVe
1354679120622452736,2021-01-28,detikcom,Warga Depok yang mau berekreasi setelah wabah virus Corona mereda bisa melancong dekat rumah saja lho. Masih banyak tempat wisata seru yang bisa kamu datangi. Berikut contohnya.  #depok   https://t.co/zSVwV2rztE
1354678091214442497,2021-01-28,radiosmartfm,"Direktur RSUD Kota Depok, Devi Maryori, mengakui masih terjadi penumpukan pasien di instalasi gawat darurat (IGD) rumah sakit.   Penumpukan itu terjadi lantaran mayoritas pasien yang datang ke IGD berstatus suspek alias belum terkonfirmasi positif Covid-19  #SmartNews @kompascom  https://t.co/ushkEf65vw"
1354669845799833600,2021-01-28,tirta_hudhi,Tempat penyimpanan vaksin covid 19 di puskesmas depok 3 sleman ! Mantep !  https://t.co/ZKrI2xEY8g
1354663001601708039,2021-01-28,liputan6dotcom,"Sembuh Covid-19, Wali Kota Depok Mohammad Idris Donor Darah Plasma Konvalesen  https://t.co/Hhj9NuxMEY"
1354662818264485896,2021-01-28,jabarnewss,"Jadi Penyintas Covid-19, Muhammad Idris Donorkan Plasma Konvalesen Di PMI Depok 👇  https://t.co/Z1WjpVZV2N  #jabarnews #beritalokal #beritahiperlokal #beritajabar #beritajawabara #jawabarat #jabar #jadipenyntascovid19 #muhammadidris #donorkanplasmakonvalesen #pmidepok  https://t.co/BCYSd4xZUZ"
1354643325874282497,2021-01-28,monitorcoid,"Gugus Tugas Percepatan Penanganan Covid-19 (GTPPC) Kota Depok melaporkan pada hari ini, Rabu (27/01/2021) sebanyak 516 warga Depok kembali dinyatakan terpapar Covid-19.  https://t.co/K1ciSgsTGO lewat @MonitorCoID"
1354640479166447618,2021-01-28,liputan6dotcom,RSUD Depok akan Gandeng Akademi Perawat untuk Bantu Rawat Pasien Covid-19  https://t.co/zYMX2R4c3E
1354635371406110724,2021-01-28,rspuricinere,"Kegiatan Onsite Test Covid-19 Swab Rapid Antigen Kamis, 28 Januari 2021 PT. Ahara Bhadranya Indonesia  #swabantigen #rapidtest #coronavirus #covıd #rspuricinere #rspc #cinere #depok  https://t.co/OqTZr60aqZ"
1354632928173711365,2021-01-28,radar_cirebon,Aksi heroik dr Nissa mengevakuasi pasien Covid-19 dari Kota Depok ke Rumah Sakit Daerah Gunung Jati (RSDGJ) Kota Cirebon menjadi perhatian masyarakat.  https://t.co/BTootBcPaD
1354630173887369219,2021-01-28,antara_jabar,Pemkot Depok siap laksanakan vaksinasi COVID-19 termin kedua - ANTARA News Jawa Barat  https://t.co/qahbs8HkBA
1354621764098170891,2021-01-28,radioelshinta,Pemkot Depok siap laksanakan vaksin COVID-19 termin kedua.   https://t.co/qWoJJYDA4w  https://t.co/BBxXYvpUIw
1354621467669843968,2021-01-28,pemkotdepok,Kamis (28/01/2021) Wali Kota @IdrisAShomad  melakukan donor Plasma Konvalesen yang akan diberikan untuk pasien Covid-19 di Kantor Palang Merah Indonesia Kota Depok. Wali Kota  juga mengajak penyintas Covid-19 untuk ikut melakukan donor Plasma Konvalesen.  https://t.co/GqzxLgrX1v
1354606978505572352,2021-01-28,detiktravel,5 Tempat Wisata Depok untuk Referensi Liburan Pas COVID-19 Reda  https://t.co/gfoKlyqDPp
1354603806936494085,2021-01-28,web_bogorkita,Potret Buruk Covid-19 Kota Depok -  https://t.co/AKatZQz6OG
1354603541931859973,2021-01-28,elshintadotcom,Pemkot Depok siap laksanakan vaksin COVID-19 termin kedua  https://t.co/gBwiuSl7a8  https://t.co/vKhvD3c2G8
1354568260138782726,2021-01-28,tribunnews,Pagi Ini 10 Pejabat Publik Kota Depok Kembali Disuntik Vaksin Covid-19 Tahap 2 di RSUI    https://t.co/wQQUnpQXjw
1354565611762802693,2021-01-28,kompascom,Itu merupakan penambahan kasus baru terbanyak di Depok sepanjang pandemi Covid-19 terjadi. Rekor sebelumnya yakni 461 kasus.  https://t.co/1Q8fLItsUj
1354467325198524420,2021-01-27,ohderable,@tempodotco info rumah sakit Tangerang-Bogor-Depok-Bekasi yang melayani ruangan isolasi beserta hemodialisis untuk pasien COVID-19🙏🙏
1354466626205175810,2021-01-27,ohderable,@KemenkesRI info rumah sakit Tangerang-Bogor-Depok-Bekasi yang melayani ruangan isolasi beserta hemodialisis untuk pasien COVID-19🙏🙏
1354446610231681025,2021-01-27,idcorner,"Video Pegawai KFC di Depok Terpapar Covid-19, Damkar Semprotkan Disinfektan Semua Ruangan Restoran -  https://t.co/oJQsFPBKxP  #INDONESIA"
1354428354393477120,2021-01-27,pemkotdepok,Vaksin Covid-19 Tahap Pertama Termin Kedua Tiba di Kota Depok  https://t.co/dgHy107yYV
1354425929389412352,2021-01-27,sindonews,"Pegawai KFC di Depok Terpapar Covid-19, Damkar Semprot Disinfektan #BukanBeritaBiasa   https://t.co/CBJoPSxPBy"
1354408785268285444,2021-01-27,republikaonline,RSUD Kota Depok cukup kewalahan merawat pasien Covid-19 yang membludak.  https://t.co/fbMS5Nwkqu
1354406641181986816,2021-01-27,fxngirlnoona,"Jaman kuliah dan magang gak lagi corona aja gak mau naik busway, kereta dll (tapi pas kuliah di depok mau gamau naik kereta sih). Gimana jaman corona.....parno mampus gue"
1354404628067086342,2021-01-27,breakmyvvals,gara2 ni orang gue dicengin corona karna tinggal di depok juga.
1354385820237500421,2021-01-27,beritasatu,"Besok, Vaksinasi Covid-19 Kedua Siap Dilaksanakan di Depok  https://t.co/ptb05RHhzJ  https://t.co/0bPTaY883U"
1354383150474874880,2021-01-27,fillahichwan,"@Gilang_Mahesa Ini yg pedansa bersama si orang jepang dr depok itu, diawali mereka terus testimoni bertiga setelah sembuh, padahal didahului budi karya sumadi yg ditutupi dg dalih non covid, maka si pedansa ini sbg pembukanya bhw RI dimasuki corona dan budi karya S baru dinyatakan trpapar."
1354379146021924866,2021-01-27,mediaindonesia,"KASUS selebritis Raffi Ahmad terkait pelanggaran protokol kesehatan (Prokes) covid-19 disidangkan di Pengadilan Negeri (PN) Depok, Jalan Boulevard, Kota Kembang, Cilodong, Rabu (27/1).     https://t.co/hEpvzyJbVe"
1354375454833004550,2021-01-27,siarandepok,Ketua PGRI Kota Depok Terpapar Covid-19  https://t.co/o3aaVcekYF
1354372306403946498,2021-01-27,arizapatria,"3/ Pagi tadi kami mengunjungi kesiapan TPU Rototan untuk pasien COVID-19, sementara 1500 makam disiapkan. Data terakhir: 4.108 saudara kita telah dimakamkan karena COVID-19 di Jakarta, 20 persennya dari luar Jakarta dgn perincian; 11 persen dari bogor, depok, tangerang, bekasi.."
1354360886291357696,2021-01-27,kompascom,"Dengan penambahan perawat, RSUD Kota Depok menaksir akan dapat memaksimalkan kapasitas hingga 145 tempat tidur isolasi bagi pasien Covid-19.  https://t.co/LN3b72IbDg"
1354353454370615296,2021-01-27,radiosmartfm,"Advokat yang menggugat artis Raffi Ahmad karena kedapatan berpesta tanpa protokol kesehatan usai divaksin Covid-19 menilai Raffi tak serius menjalani sidang.  Pasalnya, pengacara yang dikirim Raffi ke Pengadilan Negeri Depok tak punya surat kuasa.  #SmartNews @kompascom  https://t.co/71C9jBhsTB"
1354350563337461761,2021-01-27,voidotid,"DKI meminta pemerintah pusat menambah kapasitas perawatan COVID-19 di Bogor, Depok, Tangerang, dan Bekasi (Bodetabek).  https://t.co/t4e7mf2e3D"
1354350184633778179,2021-01-27,beritasatu,43% Tenaga Kesehatan di Depok Sudah Divaksinasi Covid-19  https://t.co/Q1JIgSQx8c  https://t.co/lfhHIAXQDP
1354348706787512320,2021-01-27,daulaysalsabila,barusan isi bensin di depok petugasnya nggak ada yang pake masker sumpah takut bgt. wtffff apa ini kenapa depok covid rate nya tinggi orangnya nggak aware samsek 😭😭😭
1354322906759782400,2021-01-27,wopsiesss,@subtanyarl eh tau tau corona nyamperin depok
1354321818107015168,2021-01-27,depoknegeri,"Kepala Kejaksaan Negeri Depok, Sri Kuncoro, S.H.,  https://t.co/ZmsppHe22L menyelenggarakan briefing terkait penggunaan CMS dan diikuti oleh Para Kasi, serta seluruh Jaksa yang diselenggarakan di Kantor Kejaksaan Negeri Depok dengan tetap menerapkan protokol Kesehatan Covid-19.  https://t.co/nSihpauHWo"
1354304671150526465,2021-01-27,riensayangku,"@irzayanwar @RachlanNashidik @jokowi Tapi anda juga paham, begitu kasus corona di temukan di depok, pemerintah pusat concern utk menanangi hal tsb, tapi jakarta sendiri sbg ibukota negara malah gagal menekan laju wabah dgn kebijakan yg aneh2 waktu itu 😅"
1354296248795238401,2021-01-27,adeafrizal,Jumlah kasus covid itu cara ngitungnya akumulasi kan ya ? Dari awal emak emak joget salsa reg depok itu ? Atau gimana si ?
1354292439989719040,2021-01-27,dakwahtangerang,Pagi Ini PN Depok Gelar Sidang Pelanggaran Prokes COVID-19 Raffi Ahmad  https://t.co/IBdokX2ZNM
1354282328793653249,2021-01-27,cplalpt,"@udang_jantan @DraftAnakUnpad Bantu jawab: suspect corona pertama di Indo, di depok"
1354274771089960962,2021-01-27,5news_pati,"Update Covid-19 Depok: Kasus Positif 25.185, Sembuh 19.806  https://t.co/JVyoTDCpdN"
1354265792062353413,2021-01-27,visimuslim_,Pagi Ini PN Depok Gelar Sidang Pelanggaran Prokes COVID-19 Raffi Ahmad  https://t.co/uekc2r8pGl
1354258268378460162,2021-01-27,hamzahcentre,"Selamat pagi Temans, selamat beraktivitas, jaga kesehatan selalu🙏🏻💪🏻🦅 -H. Hamzah- ⁦@Gerindra⁩ #Dprddepok  #Depok #covid-19 #Khh  https://t.co/pMXB1Nj2a0"
1354245201854828545,2021-01-27,beritasatu,Pemkot Depok Jajaki Apartemen untuk Isolasi Mandiri Pasien Covid-19  https://t.co/JuxLmcXgol  https://t.co/yrYee5QAqV
1354238463516663808,2021-01-27,kumparan,Sidang Raffi Ahmad soal menghadiri pesta usai disuntik vaksin COVID-19 digelar di Pengadilan Negeri Depok.#kumparanHITS  https://t.co/qjhv3q6Li9
1354225187538038790,2021-01-27,abufauzan1924,Pagi Ini PN Depok Gelar Sidang Pelanggaran Prokes COVID-19 Raffi Ahmad  https://t.co/T9pb6tDYci
1354225069438902272,2021-01-27,erika109_,"Pagi ini ada satgas covid di st. depok baru. Reminder, depok masih zona merah 😀"
1354215429963571203,2021-01-27,kompascom,Jumlah pasien Covid-19 di Depok yang saat ini masih harus menjalani isolasi dan dirawat sebanyak 4.826 orang.  https://t.co/J2eWSTSayb
1354198588054618112,2021-01-27,condetdukedom,"Balik liburan, dapet kabar kalo sohib bae gue tertular corona sekeluarga besar!  Keluarga om gue yg tinggal di Jogja juga tertular corona.  Belom lagi mamang gue di Depok masih disolasi bareng cucunye.  Ya Rabb.. 😭"
1354120754955046917,2021-01-27,tatasijuragan,Depok Catat Jumlah Pasien Covid-19 Terbanyak Selama Pandemi Klik untuk baca:  https://t.co/kbhrjYsdZG  Download aplikasi  https://t.co/dg6uNq7pey untuk akses berita lebih mudah dan cepat: Android:  https://t.co/pAXthzsvW6 IOS:  https://t.co/JaqfBV6fWp
1354113102921535489,2021-01-27,mas_habe,"Virus Corona Masih ‘Merona’, Kegiatan Masyarakat Depok Kembali Dibatasi  https://t.co/z5ZGxz5rej"
1354112140056137728,2021-01-27,mas_habe,"Lolos Dari Covid 19, Walikota Depok Donorkan Plasma Konvalesen  https://t.co/LVsfQT0eUR"
1354080494254747650,2021-01-26,andivox,"Pencegahan covid di level lingkungan rumah warga di Depok ini contohnya, omong kosong. Bapak-bapak yang botabene kerja mondar-mandir ketemu entah siapa setiap waktu ngga ada yang pakai masker. Lo pake masker dan jaga jarak kayak orang aneh sendiri."
1354074325003993089,2021-01-26,puturahyuni_,"Kasus covid indo udah tembus sekojut, pas bgt kemaren nyokap bilang di igd rsud depok pasiennya 60 orang, tp perawat jaga cuma 4 :))) karena yang lainnya pada tepar juga :)))"
1354072030170107904,2021-01-26,abdillah_evan,@celineajalah Eh covid di Depok dah dari kapan sih? [Basa-basi]
1354050391562801152,2021-01-26,ajat59223859,"@iwanfals Kayak lagu anak ayam berkotek mulainya 3 orang terpapar covid 19 di studio alam Depok,11 blm kemudian sejuta.semoga berakhir"
1354041213670760449,2021-01-26,riensayangku,@aewin86 Depok udah darurat covid om. Gemes banget liat orang2 masih pada kumpul ga pake masker. Sementara kita yg patuh protokol sampe engap kemana2 ga lepas maskeran 😭
1354027077901508609,2021-01-26,fvckyeall,@SiBokongBesi @calrngg @millionkwd @asumsico trus hubungan yg kontra sm artikel itu apa bang? kan feb di indo blm ada covid. kasus pertama covid di indo awal maret di depok cmiiw
1354023841262149635,2021-01-26,depokinfo_,"#News: Edukasi Masyarakat Pentingnya Vaksin Covid-19, DPD PKS Depok Gelar Webinar  https://t.co/Zs6PEYjrjz | Depok News"
1354023115433500675,2021-01-26,tandanvradio,#polripresisi #polriuntukindonesia  #Arab #Covid_19 #Airlangga #AniesBobroknyaKetahuan  ****************************** Dijual Pabrik Roti #pabrikRoti sedang beroperasi dan punya langganan cafe2 pizza. Lokasi #depok  https://t.co/8P8i4Ce0Ci
1354015200098324482,2021-01-26,depoknews,"Edukasi Masyarakat Pentingnya Vaksin Covid-19, DPD PKS Depok Gelar Webinar  https://t.co/TuTzStxCyD"
1354005862814150659,2021-01-26,beddor2,"@AliLubisACTA @aniesbaswedan @DKIJakarta Ga mutu blas, kayak org tdk paham hukum.  Anies itu gubernur DKI, khusus menangani Covid 19 di DKI. Kalo sdh masuk wilayah Jabodetabek itu sdh urusan pusat krn ada 3 provinsi Ja : DKI Jakarta Bo : Bogor - Jabar De : Depok - Jabar Ta : Tangerang - Banten Bek : Bekasi - Jabar"
1354000387859124227,2021-01-26,kumparan,"Beberapa waktu lalu, Raffi Ahmad digugat ke Pengadilan Negeri Depok terkait dirinya menghadiri pesta setelah divaksin corona.#kumparanHITS  https://t.co/kBmdcIoqq9"
1353997994492719112,2021-01-26,bibileilish,"Corona: hellow channel, welkam bek to my guys. Today, i was like... literally... getting shocked.... Mimpi aku selama ini, impian aku.... This gold play button, gua persembahkan untuk kalian, start it as a kid from depok, and now we here guys  https://t.co/WotKwL7kaZ"
1353993585956294656,2021-01-26,hamzahcentre,"Covid-19 di Indonesia tembus 1 juta kasus,,alarm untuk kita semua agar jangan kendor prokes, ayo putus rantai penularan Covid-19💪🏻🦅 #COVID19  #Covid_depok  #Depok  #Khh  https://t.co/L4PRvaZyJQ"
1353990272430948353,2021-01-26,hamzahcentre,👍🏻🙏🏻 #Covid_19  #Depok  #Khh
1353986666038366210,2021-01-26,depoknegeri,"Selasa, 26 Januari 2021  Kepala Kejaksaan Negeri Depok, Sri Kuncoro, S.H.,  https://t.co/ZmsppHe22L menerima Kunjungan Ketua Pengadilan Negeri Depok, Syamsul Arief, S.H., M.H. beserta jajaran di Kantor Kejaksaan Negeri Depok dengan tetap menerapkan Protokol Kesehatan Covid-19.  https://t.co/ltQ0KOCyb8"
1353984811275227136,2021-01-26,pemkotdepok,Penyintas Covid-19 di Depok Diajak Donor Plasma Konvalesen  https://t.co/TBiUoCTUKz
1353980138472366080,2021-01-26,pasfm,"Satu gerai restoran cepat saji di D'Mall Depok, Jawa Barat ditutup sementara. Penutupan dilakukan karena ada satu karyawan yang terkonfirmasi positif covid-19. Satu karyawan tersebut diduga terpapar dari klaster keluarga."
1353979338190950400,2021-01-26,detikcom,"Perkembangan kasus Corona di Depok, Jawa Barat, masih terus bertambah setiap harinya. Berikut daftar lengkap RS rujukan COVID-19 Depok. #Depok   https://t.co/m4tMMlRGI8"
1353977639157915649,2021-01-26,cactusjuds,Kalo liat orang2 struggle bisa lulus kuliah pas pandemi tuh jadi bersyukur. Untung Maret 2020 kemarin udah sidang. Seminggu setelahnya pengumuman kasus korona di Depok. :')
1353977326652932096,2021-01-26,mediaserunicoid,"Salah satu pegawainya terkonfirmasi positif COVID-19, rumah makan cepat saji di D’Mall Jalan Margonda, Kecamatan Beji, Depok, ditutup atau lockdown.  Baca Berita Selengkapnya di  https://t.co/G2uS70613p !!    https://t.co/k3RevaMwZQ"
1353970126001823744,2021-01-26,bbyoutae,"@schfess Sumpah inget bgttt pas itu skolah gue mau UN trus anak kelas pada gibah ""indonesia mah pd kuat kuat. Korona bakal minder sm dbd, muntaber, msuk angin blabla"" Eh besokannya korona udh masuk depok dong 😭😭😭"
1353970017608609793,2021-01-26,tributeasia,Kodam Jaya Serahkan Bantuan pada Panti Asuhan Santo Fransiskus Asisi Depok Terpapar Covid-19  https://t.co/8NpCzNEFzB
1353967920058048514,2021-01-26,depoknegeri,"Kepala Kejaksaan Negeri Depok, Sri Kuncoro, S.H.,  https://t.co/ZmsppHe22L bersama Kasubagbin, Para Kasi dan Para Pegawai mengikuti Kegiatan Sosialisasi Penggunaan Aplikasi E-Dosir yang diselenggarakan di Kantor Kejaksaan Negeri Depok dengan tetap menerapkan protokol covid-19  https://t.co/72UqDNVDTg"
1353956878053736448,2021-01-26,monitorcoid,"Pernah Positif Covid-19, Wali Kota Depok Akan Donorkan Plasma Darahnya  https://t.co/aAZzXXCcwF lewat @MonitorCoID"
1353946078572208129,2021-01-26,herman_priyatna,@rinibagyo @jokowi @Kemenkes_RI @BudiGSadikin Matur suwun mbak Rini... Ini ada kerabat kena Covid-19 dan sudah 2 positif dirawat di RS GPI Depok. Saudara2 serumah di-swab butuh waktu seminggu hasilnya.
1353944235863465984,2021-01-26,julpehhh,"@subtanyarl Ade gue gini njir ,terus ini lagi mohon2 ke gue buat ke rumah tante gue yg di bekasi soalnya cowonya orang depok kalo gasalah , nah dia mau ketemuan di bekasi gitu tapi gue bilang , lagi ga ke bekasi dulu korona gitu haha"
1353943220078616577,2021-01-26,telisiki,telisikindonesia ( https://t.co/Gi49AhhTAS) Kabar Baik! 78 Persen Pasien COVID-19 Depok Sembuh COVID-19
1353937865063841793,2021-01-26,aly_bima,"Ga Sekalian Minta Gubernur Jawa Timur Mundur Juga Bos @AliLubisACTA Sama Pak Edy Rahmayadi  Dan Bu Mensos Syantik.  Karna Belakangan Ini Pasien Covid Dari Bodetabek (Bogor, Depok, Tangerang, Bekasi) Nampungnua Di DKI Semua Loh.  https://t.co/Th6feh4Pmu"
1353937466693193728,2021-01-26,detikhealth,"Perkembangan kasus Corona di Depok, Jawa Barat, masih terus bertambah setiap harinya. Berikut daftar lengkap RS rujukan COVID-19 Depok. #Depok   https://t.co/8IZiTZ8L0i"
1353935988716752896,2021-01-26,wellofside,"@nitta606 @KutuloLoncat @subtanyarl Sama ngab di rumah sakit hermina depok juga gitu guru gua udh dari taun kemarin (2019) kena penyakit komplikasi tapi pas meninggal nya di bilang covid,tapi pas keluarganya di swab tes negatif semua"
1353929197903769600,2021-01-26,terasjabar_1," https://t.co/OrMA9iFv4O  Mencegah Penyebaran Covid-19, Permukiman Warga di Sawangan Depok Disemprot Cairan Disinfektan  #Depok"
1353910893269016576,2021-01-26,republikaonline,"Total pasien sembuh 78,48 persen dari seluruh pasien Covid-19 di Depok  https://t.co/z39vt5ChIo"
1353906321439907843,2021-01-26,deniz_bayu,@SemuPetualang @rynldyz_2 DEPOK banget ini mahhhh...... Pendukung pemerintah kedeteksi..... akhirnya ngga Lolos seleksi saat pembagian bansos COVID-19. Setiap hari menggunjing presiden dan pemerintah sambil makan dan nyemil hasil bansos 😀😀😀
1353906258437263360,2021-01-26,brainzine,"menyesal bgt sih waktu kasus pertama covid Indonesia yg org  Depok anak² kls trmsuk w teriak² di jendela   ""Depok jiayou""  dan besoknya libur sampe gw lulus"
1353890188225769472,2021-01-26,coklatstandar,"sekarang cuma bisa sampe jam 7 makan di tempat. klw ga karena covid buka nya sampe jam 2, tapi sebelumnya 24 jam.  *lokasi di perbatasan jaksel-depok ga jauh dari UI. mungkin om @_AbundantPeace tahu karena kejayaan ini tempat dimulai di era akhir 90'an - awal 2000'an  https://t.co/HJaJ4GwU9u"
1353887139465891841,2021-01-26,kompascom,"Jumlah pasien/kasus aktif Covid-19 di Depok kini mencapai 4.284 orang hingga data diperbarui pada Senin, terbanyak sepanjang riwayat pandemi.  https://t.co/V083yLA5Oj"
1353878256412319744,2021-01-26,mediaindonesia,Pemkot Depok menyiapkan 11 Tempat Pemakaman Umum (TPU) untuk memakamkan pasien terjangkit virus korona atau covid-19 yang meninggal dunia.   https://t.co/4xKdXHjuin
1353860299733000192,2021-01-26,tribunnews,KPAI Mengaku Ironis Melihat Jumlah Anak yang Terpapar Covid-19 di Depok Capai 15 Persen    https://t.co/ylZqKnI3dy
1353842677880659968,2021-01-26,idcorner,"Karyawan Positif Covid-19, Restoran Cepat Saji di D'Mall Depok Ditutup Sementara -  https://t.co/VR58gc7BJQ  #INDONESIA"
1353841846238158849,2021-01-26,kompascom,"Pemerintah Kota Depok, Jawa Barat, mencatat 260 kasus baru Covid-19, dan 247 pasien pulih, serta 7 pasien lainnya meninggal dunia kemarin.  https://t.co/jlbIuRzNwT"
1353840553150976001,2021-01-26,tribunnews,KPAI Mengaku Ironis Melihat Jumlah Anak yang Terpapar Covid-19 di Depok Capai 15 Persen    https://t.co/ylZqKnqrOY   Download aplikasi Tribunnews untuk update berita terbaru    Dapatkan untuk Android:   https://t.co/Nj9uuhpLjy    via @tribunnews
1353798548295282699,2021-01-26,mayaandy5,"SELAMA masa pandemi Covid-19 pada tahun lalu, Kementerian Sosial membagikan bantuan sosial untuk orang miskin dan rentan berupa paket bahan kebutuhan pokok senilai Rp 6,46 triliun di DKI Jakarta, Bogor, Depok, Tangerang, dan Bekasi  https://t.co/JewUc9qoK8"
1353735193887186945,2021-01-25,inewsdotid,Gerai restoran cepat saji di D'Mall Depok ditutup setelah satu karyawan dinyatakan positif Covid-19.   #Depok   https://t.co/5PCwM9H9jZ
1353733383549980673,2021-01-25,liputan6dotcom,KPAI Sebut Penularan Covid-19 Terhadap Anak di Depok Lampaui Level Nasional  https://t.co/Su0T9fqwa1
1353720612510949376,2021-01-25,hamzahcentre,"Covid segera tembus 1 juta kasus di Indonesia, jangan kendor jaga selalu prokes Temans..-H. Hamzah- #COVID19  #Depok  #Khh  https://t.co/ab1Byz0Dsf"
1353718037040381952,2021-01-25,merdekadotcom,"1 Karyawan Terpapar Covid-19, Gerai KFC di D'Mall Depok Ditutup Sementara: Gerai pun ditutup selama tiga hari. Sebanyak 13 karyawan di gerai tersebut pun menjalani swab antigen. Dari informasi yang didapat pihaknya bahwa satu karyawan yang diketahui…  https://t.co/wolAnglwce"
1353717147692720128,2021-01-25,sahabatidris,"Penyintas Covid-19, Wali Kota Depok Jadi Calon Pendonor Plasma Konvalesen  https://t.co/kRxSSjItC9  https://t.co/Tcp7JA1kXp"
1353715404376444928,2021-01-25,republikaonline,Keputusan itu disebut upaya pengendalian penyebaran Covid-19 di Kota Depok.  https://t.co/ZM3QeSBnXX
1353714469801652227,2021-01-25,tatasijuragan,Depok Catat Jumlah Pasien Covid-19 Terbanyak Selama Pandemi Klik untuk baca:  https://t.co/kbhrjYsdZG  Download aplikasi  https://t.co/dg6uNq7pey untuk akses berita lebih mudah dan cepat: Android:  https://t.co/pAXthzsvW6 IOS:  https://t.co/JaqfBV6fWp
1353713749333401603,2021-01-25,kdjatmiko,"Gugus Tugas Penanggulangan Covid 19 tingkat RW - RT pasti punya data lengkap warganya yg pernah terkena covid 19, ayo PMI Kota Depok jemput bola hubungi penyintas covid 19 melalui Gugus Tugas ... bravo PMI Kota Depok ..  👍👍👍"
1353707713444761602,2021-01-25,kompascom,"Idris yang saat menderita Covid-19 sempat diisolasi di RSUD Kota Depok itu mengatakan, dirinya baru melaksanakan tahapan awal untuk persiapan donor.  https://t.co/uylafKKKn4"
1353704546833362945,2021-01-25,amperandp,@pemkotdepok Patut dicontoh oleh pengurus RT dan RW di tempat lain.semoga warga depok semakin patuh dan jalankan protokol kesehatan dlm aktifitas sehari hari. Buat pemkot depok.mohon agar bantuan covid 19 didata ulang dr rumah ke rumah agar semakin tepat sasaran.🙏🙏
1353698930475855872,2021-01-25,sonorafm92,"20.38 #BeritaSONORA - RS yang dijajaki sebagai RS khusus ibu hamil dan melahirkan yang positif Covid-19 akan ada di wilayah Cimanggis, Depok.  https://t.co/eDSg1ZQujU @kompascom"
1353694619062521857,2021-01-25,kompascom,"RS yang dijajaki sebagai RS khusus ibu hamil dan melahirkan yang positif Covid-19 akan ada di wilayah Cimanggis, Depok.  https://t.co/YwlTCiJmbc"
1353691660262236161,2021-01-25,infodepok_id,Ayo Warga Depok Bangga Terhadap Gaspol Ojek Online Karya Buatan Depok  Gaspol Jek Ojek Online buatan DEPOK GRATISKAN Penumpang dimasa PANDEMI COVID - 19 DOWNLOAD sekarang Aplikasi nya di PLAYSTORE di search GASPOL INDONESIA   Masukan kode promo ( gaspol2…  https://t.co/u9sqf7EJk3  https://t.co/B11j9hjgp2
1353690971884630017,2021-01-25,wartakotalive,"Satu Bulan Lebih Masuk Zona Merah Covid-19, Status Kota Depok Akhirnya Berubah ke Zona Oranye    https://t.co/rTYq7aQwO0   #depokzonamerah #depokzonaoranye #COVID19"
1353655100225376256,2021-01-25,temponewsroom,"Mereka diduga menguasai kuota 12,2 juta paket bantuan sosial untuk masyarakat terdampak pandemi Covid-19 di Jakarta, Bogor, Depok, Tangerang, dan Bekasi, setelah diduga berkolusi dengan pejabat Kementerian Sosial. #DiBalikLiputan #bancakanbansos"
1353652901223124993,2021-01-25,mediaserunicoid,"Setelah beberapa pekan berada di Zona Merah COVID-19. Kini, Kota Depok, Jawa Barat berada dalam Zona Orang.    Baca Berita Selengkapnya di  https://t.co/G2uS70613p !!    https://t.co/exE2FP4MJu"
1353650813013385216,2021-01-25,nifajri,"Pak wali @IdrisAShomad .. saya warga depok yg terinfeksi Covid-19 dan berencana mendonorkan Plasma Konvalesen, saya bisa di infokan dari tim @pemkotdepok lokasi dimana serta persyaratannya untuk bisa membantu percepat pemulihan Covid di Depok ? Trims"
1353648179770662913,2021-01-25,elshintadotcom,Wali Kota Depok donorkan plasma konvalesen bantu pasien COVID-19  https://t.co/kjMFjAggcR  https://t.co/kIBomBwQpF
1353647469649752064,2021-01-25,annisaknjrn,jakarta-depok ada info rs rujukan covid guys?
1353646765107539968,2021-01-25,joglosemarnews,"Sudah Diproteksi Lebih Ketat, Ternyata Angka Anak Terpapar Covid-19 di Depok Ini Tetap Tinggi, Angkanya Capai 15 Persen  https://t.co/gU5QnQghCC"
1353646374542319616,2021-01-25,infodepok_id,"Tak Lagi Zona Merah Kini Depok Zona Oranye Kopid  Kota (Pemkot) Depok kembali menyampaikan perkembangan Covid-19 di Kota Depok. Melansir dari situs  https://t.co/1zYDOdrsy8, status risiko Kota Depok per 24 Januari 2021 berwarna oranye atau risiko sedan…  https://t.co/Z3X3yPmU0w  https://t.co/CsUPHi5Bac"
1353638732612571137,2021-01-25,beritasatu,Kota Depok Kembali ke Zona Oranye Covid-19  https://t.co/HrEzefRn3y  https://t.co/QeUZ422VjY
1353637844686782467,2021-01-25,antara_jabar,Wali Kota Depok donorkan plasma konvalesen bantu pasien corona - ANTARA News Jawa Barat  https://t.co/eyADvAVwEl
1353637374492774401,2021-01-25,brendusara,@dapitnih Di depok tempat saya rw.12  kecamatan sukmajaya dalam sebulan bisa 4 sd 5 kali terdengar pengumuman dari masjid yang wafat rata2 umur 60 tahun keatas. Tgl 16 jan kemarin tetangga sy pemakaman protokol covid
1353636311538622465,2021-01-25,sewatendad,@depoknews Alhamdulillah...smoga corona segera berlalu dan kota depok..Normal kembali utk event wedding
