id,date,username,tweet
1348908979720581120,2021-01-12,sxnkzzd,"RS Swasta yang Menangani Pasien COVID-19 (Wilayah DKI Jakarta, Bogor, Depok, Tangerang, dan Bekasi).   ㅡ Link untuk mengisi kuesioner penelitian:  https://t.co/yL3ivPrf3Q  https://t.co/yL3ivPrf3Q  Terimakasih atas partisipasi Anda dalam penelitian ini."
1348899522953375744,2021-01-12,liputan6dotcom,Wali Kota Depok Cek Kesiapan Vaksinasi Covid-19 di RS UI  https://t.co/nTAcZaodZ3
1348888614902501376,2021-01-12,emang_dasar,"@Skuyyhigh itu berkorelasi,  awal tahun belum meluas,  inget hnya jakarta dan depok kasus tracingnya dan  tetiba new normal? dan kado tahun ini ""vaksinasi"", yaelah kaku amat masih dibilang darurat.  perlambatan ya memang sdh terjadi dr sebelom covid, anda bekerja atau korban phk?"
1348858710177808385,2021-01-12,sketsaonline,Wali kota Depok Inspeksi Kesiapan Pelaksanaan Vaksinasi Covid-19  https://t.co/Rif8E0k43u
1348853926787837953,2021-01-12,anggra26,AYO MAIN LAGI  @gundamfc   #football #sepakbola #soccer #psbb #covid #corona #viral #senayan #vaksin #ayomainlagi #funfootball #pssi #timnas #ketumpssi #wsw47polri #zazgnusantara #jakarta #depok #sukabumi #indonesia  https://t.co/CgSjJLyX7t
1348834332501307393,2021-01-12,rspuricinere,Ingat! Covid-19 masih ada.  #coronavirus #covid19 #3m #rspuricinere #rspc #cinere #depok @ Rumah Sakit Puri Cinere  https://t.co/T3IXWGA6w1
1348833482512891909,2021-01-12,bakasenchou,"Halo teman2, ada yang punya info rumah sakit yang masih terima pasien COVID daerah JAKARTA/DEPOK nggak yaa? Bude aku udah sesak, tolong infonya ya temen2 huhu terima kasih banyak."
1348824468412620800,2021-01-12,rspuricinere,Kegiatan Onsite Test Covid-19  #swabantigen #rapidtest #coronavirus #covıd #rspuricinere #rspc #cinere #depok  https://t.co/QrUkLoQbGx
1348824032905334787,2021-01-12,kompascom,Seluruh kecamatan di Depok mencatat lebih dari 200 warganya sedang positif Covid-19 saat ini.  https://t.co/wCMBI13y06
1348822452273602564,2021-01-12,detak_depok,"waspada covid-19 di depok masih tinggi, patuhi protokol kesehatan...  #covid19  #coviddepok #pemkotdepok  https://t.co/TkHWVJ9LJL"
1348813274024976384,2021-01-12,ndonandoo,Please info dong guys untuk ICU Covid untuk pasien laki-laki di #Depok . Temen gue bokapnya butuh banget. Skrg masih do Rs. hermina depok.  @info_depok @depokterkini @depok24jam_  #depok
1348767910605385728,2021-01-12,kompascom,"Dalam 2 bulan terakhir, ada tambahan 2.852 pasien Covid-19 di Depok. Kenaikan setara 279 persen itu terjadi sejak awal lonjakan pada 11 November 2020.  https://t.co/TjbAf39j3z"
1348760988477112322,2021-01-12,kompascom,"Ada 3.874 pasien Covid-19 di Depok yang masih harus menjalani isolasi dan dirawat, terbanyak sepanjang riwayat pandemi sejak Maret 2020.  https://t.co/vFeEH8ezg5"
1348652948142768129,2021-01-11,msofyan,Ayo follow akun fesyen dari kamar kolaborasi aq vita moygroz dan ici depok akun instagramnya adalah: mejengdikamar didedikasikan buat kamu yang mau gaya tp tetep mau di kamar aja karena males ada korona  https://t.co/55Mq7gA964
1348631148193218561,2021-01-11,antaranews_bali,"Pemain EPAPersija Jakarta berlatih di tengah PPKM COVID-19: Para pemain muda tim Elite Pro Academy (EPA) Persija Jakarta melakukan latihan di Lapangan Nirwana Park, Depok, Senin di tengah Pemberlakukan Pembatasan Kegiatan Masyarakat (PPKM) untuk mencegah…  https://t.co/2Peetsg6IW  https://t.co/4M6IVAOF30"
1348627705575526410,2021-01-11,bc0tgrvlll,"andai aja psbb depok kyk gini juga:') warkop, kang nasgor, ini itu jam segini aja masih rame, sprti tdk ad psbb dan corona:)"
1348620347512213504,2021-01-11,republikaonline,Total pasien positif Covid-19 di Kota Depok sudah mencapai 19.824 orang.  https://t.co/vcVGuudxFC
1348620005022203904,2021-01-11,pemkotdepok,"RS Rujukan Covid-19 Hampir Penuh, Dinkes Depok Minta Perketat Protokol Kesehatan  https://t.co/dFLMnGyDde"
1348618249496363010,2021-01-11,infodepok_id,Pemerintah Kota Depok kembali menerapkan Pembatsan Sosial Berskala Besar (PSBB) mulai 11 hingga 25 Januari 2021. Terdapat sejumlah peraturan yang dibuat Pemerintah Kota Depok untuk memutus penyebaran virus corona Covid-19 itu.  Ini Daftar Kegiatan di Kot…  https://t.co/PNjGVEOJcB  https://t.co/1tUQ1IiY2q
1348614707427516417,2021-01-11,haengbokhanme,"Andai tidak ada Corona, aku pasti saat ini masih di Depok menikmati kamar Kos Laksmi ditemani Felix dan Mamut TT"
1348600250206883843,2021-01-11,laksonomics,"Ndang rampung vid covid... kangen muleh aku nelek keluarga nang depok, sowan eyang suroboyo, nang makam bapak, napak tilas nyusuri jawa..."
1348597194132054019,2021-01-11,ntmc_info,"Pantau Zona Merah Covid-19, Wakapolda Metro Berkantor di Polsek Cimanggis Depok  https://t.co/6xb9Mbo4e0"
1348571482960453643,2021-01-11,qnydky,"Juga membuat kamu suka ngguyun ngeliatin tingkah pola tetangga lagi review rumah yang belom jadi. sungguh kelewat salaman bisa ngebuat konflik antar generasi beb, pokone semua wajib disalami lan dihormaty, tydac ada yg berfikir klo gw mungkin jd carier covid dr depok."
1348559958577532928,2021-01-11,restrodepok,"Kunjungan Wakapolda Metro Jaya Brigjen Pol Drs. Hendro Pandowo  https://t.co/GJPER792E6 ke Kampung Tangguh Tugu Kec. Cimanggis, Kota Depok. Pendisiplinan Protokol Kesehatan Covid-19 di masyarakat. @TMCPoldaMetro @NTMCLantasPolri @SosmedNtmc @DivHumas_Polri  https://t.co/Wf4S9bMlSv"
1348549976364785665,2021-01-11,kompascom,Ikra mempertanyakan sejauh mana refocusing APBD Depok berdampak terhadap efektivitas penanganan pandemi Covid-19.  https://t.co/kYOGWFhPDS
1348539332022341633,2021-01-11,pikobar_jabar,"Seperti, Bodebek (Bogor-Depok-Bekasi) dan Bandung Raya yang akan mendapat porsi lebih banyak.  Provinsi Jabar mendapat alokasi 97.080 vial vaksin Covid-19 yang terbagi dalam dua tahap distribusi. Tahap I sebanyak 38.400 vial. Sementara Tahap II sebanyak 58.680 dosis 🤝"
1348534448841658368,2021-01-11,iradiobdg,"#IFAKTA Gubernur Jawa Barat, Ridwan Kamil, menetapkan enam daerah sebagai zona merah penyebaran virus corona atau COVID-19, yaitu : Kabupaten Garut, Kabupaten Ciamis, Kabupaten Karawang, Kabupaten Bekasi, Kota Bekasi, dan Kota Depok.  Selengkapnya di  https://t.co/XFGUFUdqtp  https://t.co/UYTJ4P8vLq"
1348506194839629825,2021-01-11,besokmalming,"andai dulu 3 warga depok ga kena covid, pasti Indonesia aman..."
1348492822958149635,2021-01-11,salima252,@IdrisAShomad Pak warga kompleks sy walau secara administratif masuk pondok Rajeg   Berobat ke Hermina Depok  Dan meninggal di UGD   Tetap boleh pulang dg mengaku negative covid. Warga jd ramai menyolatkan dan takziah  Ternyata diketahui keluarga bohong. Alm postive covid yg mau saya tanyakan
1348480553763233794,2021-01-11,hmstrjin,Tiada hari tanpa berantem sama abang pertama. Abangku kepala batu banget udah tau corona dari depok ke rumah ngga pake masker. Kalo dia kena covid ngga akan aku anggap jadi abang lagi
1348472898671964161,2021-01-11,aswanefendi9,"@Ameeranti Woi... Anak gua pengen berenang di Depok dah hampir setaun kolam renang tutup,, korona katanya..... 😡😡😡😡😡😡"
1348470359683518465,2021-01-11,monitorcoid,"Gugus Tugas Percepatan Penanganan Covid-19 (GTPPC) Kota Depok mencatat, terjadi penambahan sebanyak 159 kasus baru pada hari Minggu, 10 Januari 2021.  https://t.co/3vuC7nNLnn lewat @MonitorCoID"
1348450244346793986,2021-01-11,ronnie_rusli,"@Ngebutmaut Bukankah dl pertama sekali ada Covid-19 menginfeksi 3 wanita di Depok dikatakan ""Materi Polimer Covid-19"" Takut dng Air Wudhu &amp; cuaca panas. Yg takut cuaca panas benda Materi Polimer apa orangnya? Jelas orangnya takut cuaca panas, makanya kantornya ber AC &amp; jadi t4 penularan."
1348422236298887170,2021-01-11,aswanefendi9,"@irsansanusi1 Dodol emang,, lah di depok bocah pengen renang kaga ada yg blh buka.... Corona katanya😁😁"
1348401218352156673,2021-01-11,dewimjadmiko,"@tirta_hudhi Esoknya sesak nafas lg, sy keliling 6 rs di depok dan semua blg penuh dan akhirnya dpt di RS Bekasi dgn bantuan dokter langganan ayah di RSJkt. Dgn fasilitas seadanya lsg diisolasi namun ayah wafat keesokan harinya ketika hasil test covid bahkan blm keluar."
1348396457359941633,2021-01-11,kompascom,"Total ada 19.650 kasus Covid-19 di Depok. Rinciannya, 3.824 pasien masih dirawat atau isolasi mandiri, 15.364 orang sembuh, dan 462 pasien meninggal.  https://t.co/NiZcNj0TUa"
1348374483476758528,2021-01-11,ade_shakti,"@dayatia Teman kantor dpt bed krn asam lambung akut, dirawat 5 hari di salah 1 RS rujukan covid di Depok. Dia pake bpjs. Udah 3 hari ini pulang ke rumah. Alhamdulillah dan 4 hari lagi bs masuk kerja."
1348292650202402820,2021-01-10,merdekadotcom,"Depok Keluarkan Perwal Terkait PSBB Jawa Bali, Ini Aturan-Aturannya: Perwali itu adalah aturan turunan dari Instruksi Menteri Dalam Negeri Nomor 1 Tahun 2021 tentang Pemberlakuan Pembatasan Kegiatan Untuk Pengendalian Penyebaran Corona Virus Disease 2019…  https://t.co/VW0PFKVuV4"
1348286072392806401,2021-01-10,campusteast,"Sengkarut Selisih Kasus Covid-19, Depok Sudah Minta Rekonsiliasi Data Sejak Oktober 2020. Data dikorting hingga 5000 lebih. Dasar rezim korup. Data pasien aja dipotong, apalagi bansos.  Klik untuk baca:  https://t.co/D6BcpqECmI"
1348271344908001282,2021-01-10,pemkotdepok,Satgas Rilis Penanganan Covid-19 Kota Depok  https://t.co/6ENv1a7qYP
1348270927361044482,2021-01-10,infodepok_id,Ingat Luurr Besok PSBB Lagi  Mulai Senin (11/2) Pemerintah Kota Depok akan mulai memberlakukan pengetatan PSBB sesuai dengan instruksi Menteri Dalam Negeri Nomir 1/2021 tentang Pemberlakuan Pembatasan Kegiatan untuk Pengendalian Penyebaran Covid-19.  Hal…  https://t.co/20P5Sx1R8G  https://t.co/m7t8HapYEI
1348249745903390730,2021-01-10,salima252,@SitiAliahUlfah2 Bogor Depok juaranya mba di Jabar  Tapi lucunya aku ga Nemu euy website khusus COVID buat Bogor   Depok ketemu   Tapi loading gini dah sejam  Dan buka di pikobar ternyata juara  Sama kek Bogor  Padahal test tarce massive juga boro2  https://t.co/clzT39Lgua
1348246107386646535,2021-01-10,salima252,Test trace saja Jabar ini unt semua kab kota ga ada yg massive   Sudah begitupun pempus memasukkan data pakai korting pula  Masak Pemda sj sampai minta pempus agar jujur*  Ga tanggung2 data covid Depok yg dikurangi dilaporab satgas COVID sampai 5000 kasus   https://t.co/co6kkWquok
1348235730712104961,2021-01-10,salima252,@codernubie Mau dibandingkan Depok Cibinong mah gila aja sih. Disni juga sama aja ga ada yg peduli masker  Org Sumbar banyak kena habis pulang dr JKT juga   Setidaknya di Pdg swab gratis semua yg bersinggungan dg yg kena covid  Kalau disni kejadian gini aja ga ad follow up sama sekali
1348217821881270272,2021-01-10,sketsaonline,"Harlan ke 48, PPP Depok Tetap Mengabdi Untuk Masyarakat dan Komitmen Dukung Tanggulangi Pandemi Covid-19  https://t.co/3ABNSoV80n"
1348210527537942528,2021-01-10,infodepok_id,"Pemerintah Kota Depok mengganggarkan dana sebesar Rp 99 miliar untuk Bantuan Tak teduga (BTT) di tahun 2021.  Dana tersebut digunakan untuk kebutuhan darurat dan mendesak, termasuk juga untuk penanganna Covid-19 di Kota Depok.  “BTT tahun 2021 kita angga…  https://t.co/dwejrJdN3t  https://t.co/74ry2qwQvW"
1348207614409072644,2021-01-10,fierydunn,@viaudahbosen depok ujan covid
1348190444979539970,2021-01-10,bayuprasetiou,@Adomaul1 @farhandarus @kukuhberg Jadi satgas covid depok ngab
1348189523272896514,2021-01-10,codernubie,"@UmarAlChelsea_ Hari ini gw muterin depok jakarta nyari rs yg mau terima apsien covid, keluarga saya. Berangkat pagi baru ini dapet..."
1348184587889885185,2021-01-10,humas_s,Team Patko Polsek Ps Rebo yg dipimpin Ipda Mujianto bersama unsur tetkait lainya cegah Covid 19 melaksanakan penerapan PSBB bagi pelanggar di Chek Point jl.Raya Bogor Km 28 perbatasan Jaktim - Depok  https://t.co/VdadD7at36
1348181953594368000,2021-01-10,chikopicinoo,depok kek udah gaada korona anjir jalanan kafe resto rame semua 😭😭😭
1348158235132379138,2021-01-10,salima252,@Nkd_kinoy Ya gini deh Depok Cibinong mba  Kalau di kampung malah pakai sepuluh seratus seribu hari segala   Makanya eneg kalau baca dok glorified penanganan Pemda Jabar soal covid
1348101902056112128,2021-01-10,azisdadun,Bismillah...   Sahabat Banser Satkoryon Pancoran Mas Kota Depok   giat sosial penyemprotan disinsfektan dilingkungan RW. 10  Kel. Depok Jaya yg angka penyebaran covid-19 cukup tinggi  Kembali Sehat Indonesiaku  #NUMandiri #NKRI #Pancasila #BhinnekaTunggalika  #SalamKebangsaan  https://t.co/eaJMB6RQTF
1348040968063209472,2021-01-10,always_kevin,Apa kabar sama Ibu dan anak kasus 1 dan kasus 2 covid di depok ya?
1347993587649105921,2021-01-10,bolangwebberii,"@nadrpalupi menghadapi covid ? ngaca aja dulu baru ngegass komen lu saat awal pandemi masuk indonesia drbresiden hingga pejabat entengin covid,sejak kasus depok indo harusnya lokdon,batasi penerbangan aja nggak.jakarta sigap selalu direcoki dianggap saingan. rezim ini kacau kalo lu mau jujur"
1347964377635254277,2021-01-10,ivooxid,Kasus Virus Covid-19 di Kota Depok Makin Menakutkan   https://t.co/XtnkRhOETG
1347934287438352385,2021-01-09,xtraj0ss,"covid itu udah kejadian hampir 1 taun, people are aware, udah segala gala dilakuin, tapi still happen sampe sekarang. i don't get it when u say anteng2, kalo menurut u kudu dihebohin, dont u remember the first 2 cases di depok dulu which make a lot of people do panick buying and"
1347910493583892484,2021-01-09,agungmurdono,Blood Healthy UMMAT Bantu Pemkot Depok Tangani Covid-19 – Fokus Depok @MIUI |  https://t.co/BwPiJrVqi7  https://t.co/QWZxamJl6R
1347884937492406273,2021-01-09,thesinisterbear,One of my dad’s acquaintance recently died to COVID. The sad part is that he could’ve been saved but the hospital he got in (hint: it’s in Depok) didn’t do anything to him for literally hours.  When he moved to another hospital it was too late.
1347876719185645568,2021-01-09,disperindag_jbr,"Seperti, Bodebek (Bogor-Depok-Bekasi) dan Bandung Raya yang akan mendapat porsi lebih banyak.⁣  Provinsi Jabar mendapat alokasi 97.080 vial vaksin Covid-19 yang terbagi dalam dua tahap distribusi. Tahap I sebanyak 38.400 vial. Sementara Tahap II sebanyak 58.680 dosis 🤝⁣"
1347861250802270214,2021-01-09,dfrhmdn,@aglioolioooo corona ilang auto otw depok asliiiii 🥺
1347860316734963712,2021-01-09,republikaonline,"usaha menekan angka penyebaran Covid-19 di wilayah Jakarta, Depok, Tangerang, Bekasi  https://t.co/0KCQmLlHZI"
1347856780118818816,2021-01-09,monitorcoid,"Penyebaran virus Corona atau Covid-19 di Kota Depok, Jawa Barat, masih terus terjadi. Hingga kini, kasus konfirmasi (positif) terus bertambah dan belum ada tanda-tanda perlambatan.  https://t.co/Euj2jnKmAY lewat @MonitorCoID"
1347856000611536897,2021-01-09,deblitznews,"Harlah 48, PPP Kota Depok Tetap Komitmen Dalam Penanggulangan Covid-19 -  https://t.co/MiezjA8qWe"
1347854831008894976,2021-01-09,drfm_depok,"Harlah 48, PPP Kota Depok Tetap Komitmen Dalam Penanggulangan Covid-19  https://t.co/QLIGW7nf3S"
1347853724060766208,2021-01-09,fallinflower15,rapid test antigen covid-19 di depok yg lumayan murah dan cepat:  RS Harapan Depok - rapid antibodi : 130.000 - rapid antigen : 175.000 hasil keluar dalam eaktu kurleb setengah jam  informasi per tanggal 9 jan 2021 #COVID19 #rapidtest #Depok
1347846585711923200,2021-01-09,jajangridwank,"@ProfesorZubairi gang kebawah. Pertanyaan nya : mengapa pada awal ditemukan ada nya covid 19 di Depok, tdk dilakukan lock down setempat ? dan seingat saya tracing jg sdh dilakukan dan menemukan sekitar 60 org an yg pernah bertemu dgn pasien nol Ina. Mengapa hal serupa tdk dilakukan utk -4/x"
1347845371343499265,2021-01-09,republikaonline,Total pasien positif Covid-19 di Depok mencapai 19.491 orang  https://t.co/8PoU4TUd8Z
1347842745092567041,2021-01-09,timurdepok,Anggota Sabhara Polsek Depok Timur melaksanakan patroli sambang dialogis ke salah satu swalayan menyampaikan himbauan kepada pengelola swalayan dan para juru parkir untuk tidak bosan bosan menerapkan protokol pencegahan Covid-19 #disiplinprotokolkesehatan  https://t.co/kN2XaN7txI
1347842503047671809,2021-01-09,republikaonline,Tiga puskesmas di Depok ditutup sementara setelah ada tenaga medis terpapar Covid.  https://t.co/7lJ4pNd9mK
1347805299730616321,2021-01-09,sonorafm92,"Dengan adanya Pemberlakuan Pembatasan Kegiatan Masyarakat (PPKM), Anies meyakini penanganan Covid-19 di Jakarta, Bogor, Depok, Tangerang dan Bekasi akan lebih terintegrasi.  https://t.co/wvt7KvgY4n  #BeritaSonora via @kompascom"
1347803173277159427,2021-01-09,kompascom,"Dengan adanya PPKM, Anies meyakini penanganan Covid-19 di Jakarta, Bogor, Depok, Tangerang dan Bekasi akan lebih terintegrasi.  https://t.co/JcimadVbnJ"
1347780010036375553,2021-01-09,sketsaonline,"Harlan ke 48, PPP Depok Tetap Mengabdi Untuk Masyarakat dan Komitmen Dukung Tanggulangi Pandemi Covid-19  https://t.co/3ABNSpcJoX"
1347770314667687937,2021-01-09,humas_s,Team Patko Polsek Ps Rebo yg dipimpin Aiptu Iwan Kurniawan bersama unsur terkait cegah Covid 19 melaksanakan penerapan PSBB di Chek Point jl.Raya Bogor Km 28 perbatasan Jaktim - Depok  https://t.co/MnNpd1mcg0
1347748835385200640,2021-01-09,hafizhq,"Udh mulai masuk perkampungan , semoga Allah lindungi kita dari virus ini RT @VIVAcoid: Sehari, 9 Warga Depok Meninggal Akibat COVID-19  https://t.co/qJW3aUJ2oR"
1347744416719507456,2021-01-09,vivacoid,"Sehari, 9 Warga Depok Meninggal Akibat COVID-19  https://t.co/HmRRYfAISJ"
1347734765860917248,2021-01-09,15_suhartini,Pertanyaan tiap hari si mamah semenjak bilang januari mau berangkat ke depok : gimana udah ada kabar lagi berangkat kapan ? Udahlah ga mungkin berangkat sekolah kan masih belum boleh. Nanti disana susah ga ada siapa2 sendirian. Bilang aja ke dosennya masih corona wkwk
1347727329997549572,2021-01-09,depokinfo_,#News: RSUI Berikan Harga Khusus Swab PCR COVID-19  https://t.co/toOrbfSixt | Depok News
1347715848757157890,2021-01-09,pikiran_rakyat,"Daftar 10 Kabupaten-Kota dengan Kasus Aktif Covid-19 Tertinggi di Jawa Barat, Depok Mengkhawatirkan  https://t.co/5WLS4hxOa6"
1347693292939472896,2021-01-09,irwan_aja7,"@haikal_hassan Yayasan Masjid Jami Al Ihsan Depok butuh sembako dampak Covid 19.. 081381160497, Terimakasih"
1347683417748434946,2021-01-09,conan_idn,"Dalam bayangan gue,, wabah sbg bencana nasional, apapun itu akan ditanggung negara. Ternyata enggak..🤦‍♂️ Dalam bayangan Gue, PCR akan tiap RT dan Gratis, sbg langkah perluasan testing. **** RSUI Depok Berikan Harga Khusus Swab PCR Covid-19  https://t.co/cMH3HMmgdd"
1347606010081411074,2021-01-09,monitorcoid,"Jumlah warga Kota Depok yang terpapar virus Corona atau Covid-19 masih terus terjadi. Bahkan, dalam kurun waktu 24 jam terakhir warga yang terpapar virus dari Kota Wuhan, China itu bertambah sebanyak 407 orang.  https://t.co/sdXDMha5Qw lewat @MonitorCoID"
1347570813453565954,2021-01-08,pemkotdepok,Tiga Puskesmas di Depok Lakukan Dekontaminasi Cegah Covid-19  https://t.co/DtbDobXjiu
1347554912566083586,2021-01-08,merdekadotcom,"Dukung PSBB Jawa-Bali, Wali Kota Depok akan Terbitkan Aturan Turunan: Idris menuturkan, instruksi Mendagri tersebut adalah langkah tepat dalam penanganan Covid-19. Kebijakan itu sebagai jawaban dari masalah yang dihadapi saat ini.  https://t.co/MHWhuCbD0L"
1347537424767877120,2021-01-08,kompascom,"Pemerintah Kota Depok mencatat 407 kasus baru Covid-19, terbanyak pada tahun ini, sekaligus angka tertinggi kedua  https://t.co/BrVvaeuqxL"
1347533923786452993,2021-01-08,republikaonline,Penularan Covid-19 Depok semakin tak terkendali ratusan orang terpapar  https://t.co/MK4t2uKvHE
1347531686754455554,2021-01-08,tribunnews,Asisten Administrasi Pemkot Depok Terkonfirmasi Positif Covid-19    https://t.co/NwZkRBefGE   Download aplikasi Tribunnews untuk update berita terbaru    Dapatkan untuk Android:   https://t.co/Nj9uuhpLjy    via @tribunnews
1347524754387865601,2021-01-08,kvrbnfibre,"@Boytablo_ Kyknya iya, waktu awal awal covid gua kan bolak balik depok, gua batuk 2 mingguan ga sembuh sembuh pegel pegel gitu juga"
1347518457672126466,2021-01-08,beritasatu,Pemkot Depok Siapkan Sarana dan Prasarana Vaksinasi Covid-19  https://t.co/RoLRKA0WEW  https://t.co/gq2aNqMBqk
1347517606601785345,2021-01-08,republikaonline,Ruang ICU untuk penanganan pasien Covid-19 di RSUD Kota Depok penuh.  https://t.co/nlARWjp3oh
1347507377126326277,2021-01-08,saturdaypartt,@lafihtfu Depok thif sebelah jakarta... dimana covid pertama ditemukan dan penerima vaksin pertama 😔😔
1347494664115404804,2021-01-08,restrodepok,"Kegiatan Pemburuan terhadap pelanggaran prokes Covid-19 oleh TIM PEMBURU COVID-19 di wilayah hukum Polres Metro Depok, di Terminal Depok situasi kondusif. @TMCPoldaMetro @NTMCLantasPolri @SosmedNtmc @DivHumas_Polri  https://t.co/1pJqlY23hz"
1347492252302548998,2021-01-08,hey_damar,"Hi twitter, tolong infonya dong ruang isolasi di rumah sakit rujukan. Temen gw positif Covid-19 dan bukan OTG tapi diminta isolasi mandiri gara-gara kapasitas udh pada penuh. Lokasi di Depok. 🙏🏼  https://t.co/9nj97RcaLl"
1347490196326006785,2021-01-08,vandikaan,Sekarang tiap ngantor pasti ketemu ambulance. Orang depok apakah masih ga percaya COVID?
1347480370896400388,2021-01-08,miqdadhusein,"@ridwankamil Jabar hari ini 1824 kasus Covid. Ngak aneh. Di Depok itu di jl Bahagia sd jl Gema Insani, sore sampai malam tempat makan ramai tanpa Prokes.  Ngak ada tindakan penertiban...."
1347479603753807872,2021-01-08,mixmax1819,"@TirtoID Lockdown skrg juga telat pak, mestinya pas pasien covid pertama di depok langsung lockdown :("
1347475678002774017,2021-01-08,inewsdotid,"Pasien Covid-19 penuh, ICU RSUD Depok tak tampung pasien baru.  #Depok #iNewsid    https://t.co/2V27sr4W9V"
1347475480446832642,2021-01-08,husnierwinn,Gimana ngk naik covid nya kalau rapat seperti ini .. Depok oh depok
1347467251629260801,2021-01-08,falsereception,"31 Desember jumlah terjangkit 8k, hari ini datanya naik ke 9.3k  Terbaik emang penduduk kota Depok ini soal covid. Sekarang tinggal seleksi alam aja, yg punya otak DAN bisa dipakai buat mikir pasti bisa survive"
1347462058137280520,2021-01-08,nusadailycom,Pemkot Depok Dukung Penuh Instruksi Mendagri Tentang Penanganan COVID-19  https://t.co/xRCNImciKF
1347460035513782274,2021-01-08,dhuhaummat,"2️⃣. Nama : Sumiratno Jenis kelamin : Ikhwan Hubungan dg member : Ayah Nama dan group KODHAM Akhwat : Dwika/ W2.179 Nama rumah sakit : RS UI Daerah dirawat : Depok, Jawa Barat Jenis sakit : Covid-19"
1347444086681128960,2021-01-08,jabarnewss,"Nyaris Penuh! Tempat Isolasi Pasien Covid-19 di Depok Terpakai 90,32 Persen 👇  https://t.co/TWNroG04JN  #jabarnews #beritalokal #beritahiperlokal #harianjabar #jabartoday #beritajabar #beritajawabarat #jawabarat #jabar #nyarispenuh #tempatisolasi #pasiencovid19 #depok  https://t.co/6Eq6ItLra1"
1347437976205152256,2021-01-08,riensayangku,"@Santzjs Koh, coba ke RS bhayangkara brimob. Itu jg rs rujukan covid. Posisi depok deket UI /Gunadarma"
1347419824146665472,2021-01-08,unjunlemon30,@ViantyTJP @YulianaSaraya @Deebiarinaja Dom Depok ka😊 bismillah disini lagi banyak yg kena covid😭  https://t.co/MBHG7jYQn9
1347417468961050624,2021-01-08,himmeiblau,"@CNNIDdaily @KawalCOVID19 Di Depok juga RS sudah penuh semua. Tetangga saya umur 55 thn positif Covid dgn diabetes, kemaren dia bilang dia cari RS di Depok sudah penuh semua"
1347407024464621570,2021-01-08,tempodotco,"Pemakaian tempat tidur isolasi pasien Covid-19 di Kota Depok sudah 85 persen, sedangkan tempat tidur ICU 90,32 persen. #TempoMetro  https://t.co/uWNPSc9S4u"
1347406004233924608,2021-01-08,haibundacom,"Pandemi COVID-19 belum berakhir, wacana pembelajaran tatap muka pun terpaksa ditunda dahulu, Bunda. Selain Jakarta dan Depok, Kota Bogor juga menundanya.  https://t.co/UxrNCZj35q"
1347405503450660864,2021-01-08,antara_jabar,"Tempat tidur ICU COVID-19 di Kota Depok terpakai mencapai 90,32 persen - ANTARA News Jawa Barat  https://t.co/kc2mKuExrc"
1347405228904075264,2021-01-08,r3n87,"Rabu kena demam, suhu 38 derajat, diminumin paracetamol, tapi badan sakit semua Kamis, suhu udah agak turun, badan masih sakit, tambah migren Jum'at, badan keringetan ga karuan, padahal Depok kayaknya ga panas2 banget  Gue ga mau kena covid. Seriusan ini parno banget 😩"
1347405118065397761,2021-01-08,antara_jabar,Pemkot Depok dukung instruksi Mendagri terkait penanganan COVID-19 - ANTARA News Jawa Barat  https://t.co/LUCCOA7YRv
1347387418610057216,2021-01-08,amidalaniang,@ViantyTJP @MudasirRomini @YulianaSaraya @Deebiarinaja Depok....semoga saya yg dpt GA ...anak saya sdg terpapar covid sdh srminggu isoman ☝️😭
1347378695959244800,2021-01-08,kanimdepok,"Hai sahabat mido, Kantor Imigrasi Kelas II Non TPI Depok terapkan protokol kesehatan covid-19 untuk memberikan kenyamanan kepada pengguna layanan keimigrasian.  #imigrasiindonesia #infoimigrasi #indonesiaimmigration #COVID19  https://t.co/xbL5Y7eL5f"
1347378119343185920,2021-01-08,cnnindonesia,Ruang ICU RS Rujukan Covid di Depok Terisi Lebih 90 Persen  https://t.co/LeXJh7Cp2s
1347374226630606850,2021-01-08,merdekadotcom,"Tempat Tidur ICU Pasien Covid-19 di Depok Sudah Terpakai 90,32 Persen: Pemerintah Kota (Pemkot) Depok Jawa Barat menyatakan Bed Occupancy Ratio (BOR) untuk pemakaian tempat tidur untuk isolasi di daerah tersebut saat ini sudah mencapai 85 persen,…  https://t.co/V7mcYMpud2"
1347368859699871746,2021-01-08,eradotid,"Tempat tidur ICU COVID-19 di Depok terpakai mencapai 90,32 persen  https://t.co/PzO4SHLYB9"
1347368120969621507,2021-01-08,sketsaonline,"Sosialisasi Musrenbang THN 2021, Pemkot Depok Fokus Penanganan Covid-19 dan Pemulihan Ekonomi  https://t.co/VwxNUYnJLt"
1347367510954311681,2021-01-08,anakyangpendiem,Yang gaduh itu pusatt  Satgas Depok Sebut Ketidaksinkronan Data Pasien Covid-19 dengan Pemerintah Pusat #Metro #BukanBeritaBiasa    https://t.co/J4iT4AuN5r
