id,date,username,tweet
1337285181682507776,2020-12-11,hafizahrana,"Terus dengan bapak Rizieq dijadiin tersangka karena pesta pernikahan anaknya, ini kok kayak berat sebelah gitu ya. Ini polisi-polisi ngga ada yang mau main ke daerah Tangerang, Depok, Bekasi yang bikin pesta udah lengkap sama dangdutan tutup jalan pas lagi Covid?"
1337226282925400069,2020-12-11,helmihelmimoze,"@CNNIndonesia Vaksin Corona dri China, jika tidak memenuhi standard @WHOIndonesia , @BPOM_RI @Warta_MUI Sgra siapkan kesatuan Menpor&amp;Kujang untuk Tangkap @jokowi dari Istana Bogor masukan ke RTM Depok, Krn RI sudah bayar DP vaksin yg tidak jelas  @PBIDI @Puspen_TNI @bpkri"
1337215447444254720,2020-12-11,pmbintang,Kemarin w liat mobil dinas kesehatan depok bawa vaksin. Semoga itu vaksin corona
1337158990124310528,2020-12-11,ggomeztha,"wiiii kota saya loh ini [UPDATE] Kasus Covid-19 di Depok Tembus 12.109 Download aplikasi  https://t.co/i6ooNjJAN7 untuk akses berita lebih mudah dan cepat: Android:  https://t.co/mLp12LEzWN iOS:  https://t.co/fQENnbcgm3Klik untuk baca:  https://t.co/mJlmyac5Q4"
1337080140933677057,2020-12-11,bacadibabe,Satu Keluarga di Depok Makan Terigu karena Tak Dapat Bansos COVID-19  https://t.co/ErEjCML8k1  https://t.co/L4TlULrFWk
1337072266102784000,2020-12-10,zaein92958331,"@Thetrue4all @msaid_didu @jokowi @MUIPusat @muhammadiyah @fadlizon @ustadtengkuzul @hnurwahid @haikal_hassan @mohmahfudmd @nahdlatululama @tvOneNews @karniilyas @ReflyHZ @IrmanputraSidin @musniumar @dipoalam49 Dr luar negeri itu sdh shrsnya cek kesehatan, karantina, itu yg diabaikan sibibib, dan apsa akhirnya yg ngadep dia pada kena, reza patria (wagub), anies (gub) calon walkot depok juga kena covid... Ketiganya ngadep bibib, Fakta berbicara spt itu... 😁, paham ya....!"
1337048113995976704,2020-12-10,puanbahari,"pengen trip sendirian keliling jakarta, keliling depok, coba-cobain makanan yg blm pernah absen dimulut. kalo direnungin mau nangis bgt liat korona yang blm ilang"
1337041198326931456,2020-12-10,adydestagre,"Perasaanbaru kemaren kasus covid pertama di Depok. Udah mau 2021 aja,,,"
1337040386221617152,2020-12-10,bobagrentea,@princessrumii Gmn? Udah ada kulakan covid blm depok semenjak pilkada? Wkwk
1337019232387624967,2020-12-10,pingpointid,"Setelah dilakukan pengecekan, total ada 51 orang yg melakukan pencoblosan hari ini. 4 pasien non COVID-19 dan 47 pasien COVID-19.  51 Pasien di RSUD Depok Tidak Ketinggalan Menggunakan Hak Pilihnya  https://t.co/qAJbnltKF3  #PilkadaDepok #PilkadaCOVID19 @depokita  https://t.co/Q7aTh1BT8n"
1337006283497426944,2020-12-10,lusehat,Ada istilah lama yang perlu direvisi ; Warga Depok hidupnya habis buat nyari puteran balik MENJADI hidupnya habis buat nyari puteran balik sama jalanan yang ga diportal COVID.  Ngehe emang dikira virus takut sama portal apa. Logikamu mana wahai akamsi &amp; hansip sip sip
1336995679005241345,2020-12-10,detikcom,"3 kota administratif di DKI Jakarta kembali masuk zona merah. Tangerang, Tangerang Selatan, Depok dan Bandung juga kembali masuk zona merah COVID-19.  #covid19 #newnormal   https://t.co/VUTAMOfiFh"
1336971992440901632,2020-12-10,detikhealth,"3 kota administratif di DKI Jakarta kembali masuk zona merah. Tangerang, Tangerang Selatan, Depok dan Bandung juga kembali masuk zona merah COVID-19.  #covid19 #newnormal   https://t.co/rbeGPfHNvb"
1336961309351415811,2020-12-10,honeyyybeear,kalo 2020 kaga ada corona gua yakin banget ini kpop idol ke indonesia udah berasa kek pp depok-bekasi
1336960912914141185,2020-12-10,tempodotco,"Dadang Wihana mengatakan, sejak Senin 7 Desember 2020, Satuan Tugas Penanganan Covid-19 menyatakan Kota Depok bersama 6 kota kabupaten se Jawa Barat masuk zona merah. #TempoGrafis  https://t.co/TKDwuZ6I0r  https://t.co/Mg0D06UGMd"
1336945014522273793,2020-12-10,pemkotdepok,"Semoga aplikasi DSW ini bisa menjadi media bagi warga Depok untuk merasakan berbagai kemudahan dalam mengakses puluhan layanan informasi Smart City. Mulai dari layanan pengaduan, perizinan, informasi Covid-19, layanan kesehatan, dan puluhan layanan lainnya.⁣⁣ ⁣⁣"
1336942742576848900,2020-12-10,kompastv,"RSUD Kota Depok, Fasilitasi Pasien Covid-19 Lakukan Pencoblosan  https://t.co/WIBlmRn1gH  https://t.co/kSneus1lUI"
1336935498342809600,2020-12-10,pungpurwanto,Salut utk anggota KPPS ini @KPU_ID  Begini Perjuangan KPPS Layani Warga Terpapar Covid-19 di Depok  https://t.co/cVIISetWim
1336921763947532288,2020-12-10,elsielsss,"@ayusintya_SSR wah ayuuu suami ayu positif covid? :(( sabar ya ayu, semoga cepet pemulihannya ya biar ga lama pisah""nya 🤲 Semoga ayu dan keluarga depok selalu sehat dan terjaga... 🤲 Iya kesel ya yu, suka ada aja yg bandel kesana sini apalagi kantor wfo, aku kira jabodetabek wfh semua yu"
1336911434404392960,2020-12-10,depoknegeri,"2. Peninjauan ini memastikan Pemilihan Walikota dan Wakil Walikota Depok dapat berjalan dengan Demokratis , aman dan tentunya tetap menerapkan protokol Kesehatan guna memutus mata rantai penyebaran Covid-19. #walikotadepok  https://t.co/Uoq07gVM5z"
1336907433038336002,2020-12-10,jjrizal,"yg menang golput en bomat bung, ada info sejak 2010 angka golput depok 45.81 persen, lantas 2015 turun sedikit 43.88 persen, nah sekarang beberapa pengamat meramalkan akan kembali berjaya dlm perolehan suara krn wabah Covid 19 en terutama krn lu lagi lu lagi"
1336890836848537606,2020-12-10,ddtcnews,"LOMBA GRAFITAX DDTCNEWS 2020: Arie Widodo, Depok, Jawa Barat Insentif Pajak Covid-19  https://t.co/tb0klLw3KV  #lombainfografispajak #grafitax #infografis #pajak"
1336886960443465728,2020-12-10,fadlizon,"Mensos Juliari Korupsi Dana Bansos Covid-19, Fadli Zon: Memang Sudah Salah dari Awal - Pikiran Rakyat Depok  https://t.co/2a6plLISSD"
1336882610417483779,2020-12-10,jatamnas,Sementara itu...  2.280 Pemilih Pilkada Depok Positif Covid-19  https://t.co/KbMsgG4Vvz
1336854647680581632,2020-12-10,prambors,Gubernur Ridwan Kamil merencanakan Depok sebagai kota pertama yang akan mendapatkan vaksin Covid-19 di wilayah Jawa Barat.  #PramborsNews    https://t.co/EWART1F1mk  https://t.co/rPkiNgxjTs
1336847293069160450,2020-12-10,jaring_,Partisipasi pemilih di sejumlah Tempat Pemungutan Suara (TPS) Depok tak sesuai target. Banyak pemilih enggan menggunakan hak suara karena Covid-19.   https://t.co/zlAtSyu7BU  https://t.co/UHasAcpVki
1336845715692130305,2020-12-10,jaring_,"Pasien isolasi mandiri positif Covid-19 mencoblos surat suara tanpa menggunakan sarung tangan. Kejadian ini ditemui di TPS 52 Kelurahan Mekar Jaya, Sukmajaya Kota Depok   https://t.co/0IPhxVB9Pz  https://t.co/c1FKK7cxlr"
1336842048373026818,2020-12-10,abang_faey,@DheeCanim Gada bund di depok cuma 2.280 orang pemilih  positif covid 19 😑😔   https://t.co/Bgl5GUyo8x
1336835825141645312,2020-12-10,uno_vic,"@CNNIndonesia Budayakan membaca: Jakarta, CNN Indonesia --   Ketua Komisi Pemilihan Umum (KPU) Kota Depok, Nana Shobarna mengatakan ada 2.280 warga terkonfirmasi covid-19 yang masuk dalam Daftar Pemilih Tetap (DPT) pada pemilihan kepala daerah (Pilkada) 2020."
1336829861982158856,2020-12-10,luki_suarez,@VIVAcoid 2.280 Pemilih Pilkada Depok Positif Covid-19  https://t.co/H11YgrgF6P
1336802816027815937,2020-12-10,kompascom,Jumlah pasien Covid-19 yang masih dirawat atau isolasi mandiri di Depok mencapai 2.362 orang.  https://t.co/ExSZpekAIv
1336736400931078150,2020-12-10,panjaitannoven,"@MataIndonesia8 Masa 1hr ini lsg dinyatakan Positive Covid? Apa mmg tdnya sdh positive tp ttp datang ke TPS? Di TPS 5 depok td Saya nyoblos, protokol kesehatan sangat ketat. Sblm masuk area TPS wajib cuci tangan, Dan di kasih sarung tangan utk nyoblos. Dan di TPS cuma Ada petugas. Jgn2 hoax aja"
1336715263580880897,2020-12-09,zahrah40291660,2.280 Pemilih Pilkada Depok Positif Covid-19  https://t.co/MhBsraZjDD
1336715156412231682,2020-12-09,zahrah40291660,@tribunnews 2.280 Pemilih Pilkada Depok Positif Covid-19  https://t.co/MhBsraZjDD
1336704399616266241,2020-12-09,1800crying,@transparentiger kyk orang depok dpt vaksin covid
1336693094725513216,2020-12-09,kompasiana,"Pilkada Depok 2020 Zona Merah, Begini Protokol Kesehatan Covid-19 di Wilayah Saya  https://t.co/xKEnguDRrd"
1336689594696286209,2020-12-09,ydgiannp,Sebanyak 1.280 warga Depok tercatat sebagai pasien covid-19 di 24 rumah sakit dan 1.152 lainnya melakukan isolasi mandiri atau orang tanpa gejala (OTG)  CLICKBAIT BANGSATT
1336685327868555267,2020-12-09,a_i_u_ek0,Udah ga heran depok kan jadi pioneer covid 19 di Indonesia
1336677659686830081,2020-12-09,putraerlangga_,2.280 Pemilih Pilkada Depok Positif Covid-19  https://t.co/ZJV9neZWMu
1336675069272023048,2020-12-09,hongkiy1,"depok emang sdh ""dikapling"" ma pks, walaupun cawalkot nya kena covid-19 tetap aja dipilih, cmiiw 🙏"
1336665431868723202,2020-12-09,semut_ibrahim_,Sssttt... 🤫  Siapa yg harus bertanggungjawab jika penyebaran semakin masif?  @KPU_ID @ridwankamil  2.280 Pemilih Pilkada Depok Positif Covid-19  https://t.co/H2cfvqptbF
1336653783854563328,2020-12-09,ronin4711,"""Ketua Komisi Pemilihan Umum (KPU) Kota Depok, Nana Shobarna mengatakan ada 2.280 warga terkonfirmasi covid-19 yang masuk dalam Daftar Pemilih Tetap (DPT) pada pemilihan kepala daerah (Pilkada) 2020"" . . Yang masuk DPT bukan positif pas selesai nyoblos"
1336650381061836800,2020-12-09,jr205148,"ngeri juga pks bisa hampir kalah di sini... gw ga expect sampe 46%.  katanya gara gara om wowo kena hajar isu lobster, lalu kasus bansos covid, eh tim paslon 1 santai santai (atau terlambat mencegah?)  dan tau sendiri warga depok banyak yg gapernah ngelaju ke jakarta"
1336644305797042176,2020-12-09,abadiaulia2,"Prof @mohmahfudmd sedang ada pertemuan dg Arab Saudi,sementara ada berita sekitar 2000an orang (termasuk petugas KPPS) di Depok terdampak Corona #BeritaTerkini"
1336643734277038081,2020-12-09,rozydrwn,"@CNNIndonesia Judulnya kebiasaan biar rame, padahal tinggal bikin judul “ 2.280 pasien covid di depok ikut serta mencoblos/memilih di pilkada depok”"
1336641000920371202,2020-12-09,merdekadotcom,"Cawalkot Depok Idris: Saya Diberi Ujian Positif Covid-19 Karena Kurang Sedekah: Selama isolasi, Idris memanfaatkan untuk merenung atas dosa yang telah dilakukannya.  https://t.co/PaLTkTQXjF"
1336639365745844224,2020-12-09,bobotoh_doank,"@pikobar_jabar Min, katanya yg nyoblos di depok 2000an positif corona ya??"
1336627164712615937,2020-12-09,vitobasterbine,Cawalkot depok positif COVID-19 tapi nyoblos di tps demi kebutuhan konten di tv😖😖
1336624968042483712,2020-12-09,detikcom,"cawalkot Depok, Mohammad Idris sempat dinyatakan positif Corona. Idris berbagi cerita tentang kondisinya saat pertama kali mengetahui Corona menjangkitinya. #Depok #MohammadIdris  https://t.co/cACSJrGAQS"
1336618801333325825,2020-12-09,beritasatu,KPU Depok Jemput Hak Suara 524 Pasien Covid-19  https://t.co/DOJtdMk2Yo  https://t.co/AKm2G99VyB
1336609898902159361,2020-12-09,penghunimu,@efenerr Terus di depok ada 2.280 pemilih yg positif covid. Impresive 👏🏻
1336609271950143493,2020-12-09,fathandiaz_emir,"@CNNIndonesia Ini bocoran informasinya  ""Ketua Komisi Pemilihan Umum (KPU) Kota Depok, Nana Shobarna mengatakan ada 2.280 warga terkonfirmasi covid-19 yang masuk dalam Daftar Pemilih Tetap (DPT) pada pemilihan kepala daerah (Pilkada) 2020""  Sebelum Pilkada, mereka udah pada kena virusnya"
1336602420793774086,2020-12-09,merrynancylia,Pilkada Depok... Era covid...  Semoga yg terpilih walkot depok amanah dalam bertugas...  #kpps  #pilkada  #depok  #covi̇d19  https://t.co/uUXuXhs4e6
1336596198698885120,2020-12-09,cakradara20,"@farhanalv klo dibaca lagi, mending judul beritanya ganti   2.280 orang di depok yang positif covid (dalam perawatan &amp; isolasi mandiri) tetap terdaftar sebagai pemilih pilkada serentak   bukan terpapar setelah datang ke TPS tutup jam 1 siang tadi"
1336594817048965120,2020-12-09,hapriyandi1,"@iwanfals Dia yg Corona bisa memang  apalagi kalo dia sehat yak, leren dah warga Depok 👍👍👍"
1336591010399354880,2020-12-09,nugrahaargy,@CNNIndonesia Saran judul berita = 2.280 Pemilih Pilkada Depok merupakan Pasien Positif Covid-19
1336586998430138368,2020-12-09,metaforamalam,"@_chesalestyn @CNNIndonesia Hahaha lanjut.. aku cuma usul sama cnn gimana kalo judulnya ""2.280 pasien covid-19 di Depok Masuk DPT atau 2.280 pasien Covi-19 punya Hal pilih"" biar g ambigu"
1336586708897259520,2020-12-09,komceu,"@risara94 mungkin mksd beritanya daftar pemilih yng udah positif covid sblm pemilunya deh ""Ketua Komisi Pemilihan Umum (KPU) Kota Depok, Nana Shobarna mengatakan ada 2.280 warga terkonfirmasi covid-19 yang masuk dalam Daftar Pemilih Tetap (DPT) pada pemilihan kepala daerah (Pilkada) 2020"""
1336582558759325700,2020-12-09,herditiya1,"Semangat, hayo nyonblos! Jangan Golput. Selamatkan hak pilih kalian.  2.280 Pemilih Pilkada Depok Positif Covid-19    https://t.co/xdUkhnXEGq"
1336581817307033601,2020-12-09,alphytodia,"gilee judulnya parah.. padahal bukan positif karena pilkada.. Tinggal dikasih kata ""Pasien"" doang susah amat.. Harusnya: ""2.280 Pasien Positif Covid-19 Tercatat Sebagai Pemilih Pilkada Depok"" atau ""2.280 Pemilih Pilkada Depok Adalah Pasien Positif Covid-19""  damn media"
1336579674315530245,2020-12-09,cnnindonesia,2.280 Pemilih Pilkada Depok Positif Covid-19  https://t.co/qTGCMd1hoM
1336568689705959425,2020-12-09,marwan_marup,"Pradi-Afifah Akan Utamakan Penanganan Covid-19 di Depok jika TerpilihDownload aplikasi  https://t.co/TfPS5DUXFP untuk akses berita lebih mudah dan cepat: Android:  https://t.co/8xcMtQYR9E iOS:  https://t.co/8x26vl1Wt7Klik untuk baca:  https://t.co/L9NzD5sb17"
1336567927890317312,2020-12-09,iqbaldotdot,"@pluiviophile @collegemenfess Di lembang, bandung namanya jendela alam. Tapi kayanya ga nerima dia deh soalnya covid. Kalo dom kamu jakarta depok, bisa coba ke d'kandang. Dia agrowisata tapi nerima magang kalo gasalah"
1336563946078138370,2020-12-09,terasjabar_1," https://t.co/YVUxz0Q6Ar  Pemkot Depok Belum Maksimal dalam Menangani Pandemi Covid-19, Cawalkot Depok Pradi Takut Muncul Klaster Pilkada  #depok"
1336563835767988224,2020-12-09,erikuyyy,@ISpazzer @megamrani @hwangjinara_ @collegemenfess Dlu ak di asterdam pas covid baru di depok. Cuman 700an 2 minggu
1336562741486657537,2020-12-09,radioelshinta,Petugas KPPS jemput bola atau mengambil suara dari masyarakat yang diduga terpapar Covid-19 di salah satu perumahan Kawasan Depok Jawa Barat. 📸 Bai #ElshintaEdisiSiang  https://t.co/ZdgQpjg3Hz
1336551411274850305,2020-12-09,httpsdazaigf,warga Depok abis vaksin covid..
1336531280687558662,2020-12-09,naura_diva,@TukangPomPom Depok dapet vaksin corona duluan
1336527630141542401,2020-12-09,vivacoid,"Sembuh dari COVID-19, calon petahana Wali Kota Depok, Mohammad Idris, mendatangi TPS 14 di dekat rumahnya di kawasan Jatimulya, Kecamatan Cilodong, Depok, Jawa Barat, Rabu pagi, 9 Desember 2020. ""Sehat-sehat ya semua,"" katanya kepada wartawan.  https://t.co/nejRRwF9Tp  https://t.co/Y5YW7n9ud5"
1336525785956544513,2020-12-09,detikcom,"Calon Wali Kota Depok nomor urut 1, Pradi Supriatna, berjanji akan fokus menangani pandemi Corona (COVID-19) jika terpilih nanti. #Pilkada2020 #Depok  https://t.co/MOgxqIWLSO"
1336515375861665793,2020-12-09,vrastoadjie,"@cumi_ksr @tubbirfess Kalo Depok terjadi Covid backfire / zombie apocalypse terus ditembokin, Daerah terdekat sama Depok mgkn akan dijual murah krn deket sama pusat Apocalypse nya... 😭😭😭"
1336513031723864065,2020-12-09,vivacoid,"Sembuh dari COVID, Petahana Wali Kota Depok Datangi TPS Bareng Istri  https://t.co/Gfo1G6moUx #pilkada"
1336510767424655361,2020-12-09,kompascom,"""Mudah-mudahan Warga Depok datang ke TPS , enggak usah takut masalah virus Covid-19 karena untuk kepemimpinan Depok ke depan,"" ucap Imam. #Pilkada2020  https://t.co/7h7VfAUms7"
1336507703070482433,2020-12-09,indopolitika,"Pilkada Serentak, Pasien Covid-19 di RS Depok Difasilitasi untuk Mencoblos  https://t.co/pPidEjej4G"
1336507675278917636,2020-12-09,indopolitika,"Pilkada Serentak, Pasien Covid-19 di RS Depok Difasilitasi untuk Mencoblos  https://t.co/pPidEjvTWe via @Indopolitika"
1336505458819956738,2020-12-09,slickfinger_,"Kayaknya Depok si dia lagi nih.  Historically speaking petahana pasti menang &amp; fakta bahwa geng itu mostly ga terlalu peduli covid, yg penting suara masuk &amp; menang lagi.  Di sisi lain, geng progresif dikasih calon yg ga kredibel, udah mah covid. Enakan juga netflixan.   Yeay pks!"
1336498937037873159,2020-12-09,kompascom,"“Mudah-mudahan masyarakat bisa terus ikuti protokol Covid-19 hari ini dan klaster pilkada tidak akan terjadi,” kata calon wakil wali kota Depok itu.  https://t.co/cTNX32EjjQ"
1336498530752446464,2020-12-09,sehatdif,@txtdaridepok Harapanku depok bebas corona dulu deh
1336498352754724864,2020-12-09,fitradiobandung,"Gubernur Jawa Barat Ridwan Kamil mengatakan, ada tiga pihak yang diutamakan mendapat vaksin Covid-19, yakni, tenaga kesehatan, TNI dan Polri, serta warga di zona merah yang mayoritas berada di wilayah Bogor, Depok, Bekasi (Bodebek) dan Bandung Raya. #StayFitForLife  https://t.co/1cRE6sysHV"
1336493824575561731,2020-12-09,riensayangku,"Baru kali ini depok bebas calon dari PKS, gegara kandidat incumbent kena covid. Mau ngalap berkah, malah dapet penyakit dari si rijik 🤣🤣🤣"
1336493300430204930,2020-12-09,riensayangku,"@FerdinandHaean3 @KPU_ID @bawaslu_RI Baru kali ini depok bs bebas dari kandidat PKS, gegara kandidat incumbent kena covid 😂😂😂"
1336491923058511874,2020-12-09,sctv,"KPUD Depok tak sediakan TPS di rumah sakit rujukan covid-19. Sebagai gantinya, KPPS akan mendatangi pasien secara langsung. #Liputan6SCTV #Pilkada2020  Berita lainnya di:  https://t.co/qb6lW4Dqjd  https://t.co/vHsABaiwc4"
1336481923921670145,2020-12-09,beritasatu,KPU Depok Sambangi Pasien Covid-19 yang Dirawat untuk Beri Hak Suara  https://t.co/JIkAHB9ChI  https://t.co/OcMq4vhJTL
1336474022893158401,2020-12-09,tempodotco,"Pilkada 2020 Hari Ini, KPU Depok Akan Datangi 24 RS Jemput Suara Pasien Covid-19  https://t.co/Gb4bGWuohJ #TempoMetro"
1336465155304038402,2020-12-09,minheemyan,"@aigoorenjun Udahh,kl dulu msh ad busway depok bkn kan,skrg rutenya tutup krn korona"
1336461065484263424,2020-12-09,kompascom,"Pemerintah Kota Depok mencatat 259 kasus baru Covid-19, tertinggi sejak 27 September sekaligus temuan kasus baru terbanyak kedua selama pandemi.  https://t.co/nwlTQwsy1N"
1336452757390196738,2020-12-09,kompascom,Kota Depok kembali ditetapkan sebagai zona merah atau wilayah berisiko tinggi penularan Covid-19 untuk pekan ini.  https://t.co/MERNKSowQi
1336446473278373890,2020-12-09,samuelyuv26,"KPU Kota Depok memastikan pasien Covid-19, baik yang melakukan isolasi di rumah sakit maupun di rumah, tetap bisa memilih. Jadi semuanya bisa memilih ya, tidak perlu khawatir  https://t.co/CvzubACR5L #AyoNyoblos  https://t.co/h1w9aKxynR"
1336445540238684166,2020-12-09,ivanckak,"KPU Kota Depok memastikan pasien Covid-19, baik yang melakukan isolasi di rumah sakit maupun di rumah, tetap bisa memilih.  Jadi semuanya bisa memilih ya, tidak perlu khawatir.  https://t.co/F0Sn9cvy9z #AyoNyoblos  https://t.co/nxJSMGZi4e"
1336444323705974784,2020-12-09,marianunez439,"KPU Kota Depok memastikan pasien corona, baik yang melakukan isolasi di rumah sakit maupun di rumah, tetap bisa memilih ....   https://t.co/zkzDGvNCEw #AyoNyoblos  https://t.co/YsLQDy5cPs"
1336444193183576064,2020-12-09,aletaega,"KPU Kota Depok memastikan pasien Covid-19, baik yang melakukan isolasi di rumah sakit maupun di rumah, tetap bisa memilih  https://t.co/sVt1dW7Dxm #AyoNyoblos  https://t.co/5va2HCWYIR"
1336433607737405441,2020-12-09,beritaviralhar1,"Masuk Zona Merah Covid-19, Kota Depok dan Kabupaten Karawang Siaga Pilkada Serentak 2020  https://t.co/EmGRTnxxTu"
1336364712615837697,2020-12-09,denverebigotta,"Tips ke TPS dimasa Pandemi Covid-19.  Patuhi prokes dg menggunakan masker, jaga jarak, dan mencuci tangan setelah mencoblos. Dan yang terpenting coblosnya SATU tusukan aja biar SAH!  @Paltiwest3  #depok #depokkuliner #depokterkini  https://t.co/Ot6AOOmr2h"
1336364638875750400,2020-12-09,mrchikoko,"Tips ke TPS dimasa Pandemi Covid-19.  Patuhi prokes dg menggunakan masker, jaga jarak, dan mencuci tangan setelah mencoblos. Dan yang terpenting coblosnya SATU tusukan aja biar SAH!  @Paltiwest3  #depok #depokkuliner #depokterkini  https://t.co/lW7YRPV54b"
1336363336921800705,2020-12-09,whitckitten,"@snewtay jogja murah2, bandung estetik😌‼️ depok covid😒😒"
1336360897309147138,2020-12-09,mcfinkel,"Tips ke TPS dimasa Pandemi Covid-19.  Patuhi prokes dg menggunakan masker, jaga jarak, dan mencuci tangan setelah mencoblos. Dan yang terpenting coblosnya SATU tusukan aja biar SAH!  @Paltiwest3  #depok #depokkuliner #depokterkini  https://t.co/LMyGEsTxWa"
1336350001602019328,2020-12-08,kyungsoo_dohh,"depok depok.. udah jadi kota pertama kali yang ke suspect korona, sekarang kota yang pertama kali jadi percobaan vaksin wkwk kasian sekali"
1336344503804862464,2020-12-08,antara_jabar,Vokasi UI bina koperasi Kota Depok agar bertahan saat pandemi COVID-19 - ANTARA News Jawa Barat  https://t.co/F7z7t2dNNm
1336338520055500805,2020-12-08,infoka_id,Depok Jadi Kota Pertama yang Terima Vaksin Covid-19 Sinovac  https://t.co/vutpsO3uYm
1336333639802519554,2020-12-08,kariin91,"Jakarta ga pilkada, tapi depok sama tangerang pilkada rabu besok. Prediksi bakal ada kluster covid apalagi di daerah yg deket kota satelit.   Ini artinya mari kita tarik rem darurat buat kita sendiri. Siapin ide buat karantina sama anak lagi. Setidaknya sampe tahun depan.."
1336322084562034690,2020-12-08,bangnalar,"Yuk bagi kamu yang besok ikutan Pilkada di Depok..  Jangan lupa pakai masker.. Cukup SATU saja yah.. Bisa pakai Face Shield, tetap SATU saja..  Jaga Jarak Lebih dari SATU meter untuk mencegah penyebaran corona..  #depok #PilkadaDepok  https://t.co/KMRdsg65KI"
1336315567116935175,2020-12-08,amndptr,@letafitriani depok paved the way let....  dr mulai begal sampe covid 😩
1336310548820979720,2020-12-08,fikrisadathar,Corona pertama di Depok panik ✓ Dapet vaksin pertama buat Depok panik juga ✓  Serba salah asw 🤭
1336307440690847745,2020-12-08,tribun_jakarta,"Dijamin Sehat dan Bebas Covid-19, Ribuan Personel Gabungan Amankan Pilkada Depok Jalani Rapid Tes   https://t.co/69ad5vTBz0"
1336307118962597894,2020-12-08,tribun_jakarta,"Jelang Pencoblosan Pilkada 2020, Satgas Kota Depok kembalu Tetapkan Zona Merah Penyebaran Covid-19   https://t.co/V5myAyhsFQ."
1336302862838579205,2020-12-08,chill7skies,@tubbirfess jadi inget dulu heboh 2 org pertama korona dari depok
1336302190894280704,2020-12-08,mediaserunicoid,Pilkada Depok yang berlangsung saat pandemi Covid-19 menjadi tantangan baru bagi KPU Depok. Terlebih dalam pemenuhan hak suara bagi pasien Covid-19 di Kota Depok.  Baca Berita Selengkapnya di  https://t.co/G2uS70613p !!   https://t.co/I1hBME3Xj5
1336294264855289859,2020-12-08,haimagazine,Depok Disebut Kota Percobaan: Pasien Covid Pertama dan Vaksin Sinovac    https://t.co/zXuSeueAIS  https://t.co/7J3Ebz4qCi
1336292195939143680,2020-12-08,chubaiii,"@nindanurulh @pus___ @yorisep @umahasna Monmaap karena biang keladi pertama covid dari Depok, akhirnya diputuskan begini  https://t.co/9M3K35Y3lc"
1336290363141582849,2020-12-08,then_kimberly,"@TaliUdeng Jebakan Betmen nih.  1. Kemungkinan RI 1 BISA kena Covid akibat ditularkan Rijiek. Itu telah menewaskan seorang pentolan FPI, Wagub DKI, gubernur DKI dan walikota Depok. 2. Presiden bakalan dipidana karena dianggap intervensi hukum. 3. Diduga Caplin bakalan kudeta"
1336288849585049600,2020-12-08,muhammadarifwdr,Pilkada Depok Disebut Paling Rawan Penyebaran Covid-19 |Republika Online  https://t.co/ilMQedfrb7
1336272197871013889,2020-12-08,mediaserunicoid,"Satu hari menjelang Pilkada berlangsung, Kota Depok kembali memasuki zona merah Covid-19.  Baca Berita Selengkapnya di  https://t.co/G2uS70613p !!   https://t.co/XjB4pYUf1J"
1336266833830227971,2020-12-08,depokinfo_,#News: Pasien Covid-19 Tetap Bisa Memberikan Suara  https://t.co/Djp4hfdFiL | Depok News
1336266827643539457,2020-12-08,depokinfo_,#News: Waspada..Depok Kembali ke Zona Merah Covid-19  https://t.co/ILorrbYjn3 | Depok News
1336264201124265984,2020-12-08,dearestzuho,"apa2 depok, katanya corona pertama yg kena org depok, begal di depok, vaksin covid juga percobaan pertama di depok hshshs"
1336261704057929729,2020-12-08,agpydi075,@ChristoferRully @tubbirfess sebelum covid dateng Hepatitis tuhh dari depok rame ampe gw ikutan kena
1336261434330779650,2020-12-08,depoknews,Waspada..Depok Kembali ke Zona Merah Covid-19  https://t.co/p7eRE8czQm
1336253885359423490,2020-12-08,hogfwarts,ini kalo vaksin covid yang nyampe ke depok itu sebenernya virus jombi senjata pertama yang gue cari AK 👁👄👁 #.
1336253549328535553,2020-12-08,pemkotdepok,"Tetap WASPADA, Covid-19 masih ADA!⁣ Pantau terus angka Covid-19 di Depok dengan Layanan Kampung Siaga!⁣ ⁣ Melalui layanan Kampung Siaga di aplikasi Depok Single Window ini, kamu bisa memantau angka persebaran Covid di wilayah Depok.  https://t.co/iBxV9mx3Yb"
1336247502849200128,2020-12-08,wooziminez,Yg kena corona pertama kali juga dari depok bukan sih?
1336233347379507200,2020-12-08,berita_corona,"#Update Corona Jabar Hari Ini, 8 Desember 2020: Bekasi, Depok, Bandung Catat Kasus Positif Tertinggi - Pikiran Rakyat Bandung Raya - Pikiran Rakyat #Corona #Korona"
1336228731757633536,2020-12-08,detak_depok,Ribuan Personel Pengamanan Pilkada Depok Non Reaktif COVID-19  https://t.co/aARjndu0i8  #AyoKeTPS  @RinjaniJB @PemudaDepok @maryanto0207197 @RizkiR4madani @bang_iepul @RelawanPraja @RiniNB_1046 @SulistyoriniSu1 @bidge249
