id,date,username,tweet
1365676988321566723,2021-02-27,akhdanrafif13,"@literarybase Sebelum corona kira-kira bulan Januari, beli buku di gramed depok"
1365631044053962755,2021-02-27,nabilaputri___,Ya allah malming jalanan jkt ke depok najis bgt bener2 najis🙏🙏🙏 org2 pd corona mau malming kmn si fak🙏🙏🙏 #yukistigfaryuk
1365624310426001411,2021-02-27,ijulekeh,"Halo gaes, kalo ada yg butuh kerjaan dgn spesifikasi berikut :  - design 40% marketing 60% - fulltime - flexible hours - full wfh (selama corona), base-nya di depok - supportif environment - ga bisa marketing gpp yg penting mau belajar  Bisa dm ya saya ya, thank u🙏"
1365609531825291264,2021-02-27,naito_asukabe,jalanan Depok terlihat macet lg apakah tandanya situasi sudah kembali normal.. tanpa covid?
1365605405057949701,2021-02-27,pajakdepokcmg,"Dalam rangka upaya pencegahan penyebaran Covid-19, pelayanan perpajakan tatap muka di KPP Pratama Depok Cimanggis akan diberhentikan sementara dari tanggal 1 Maret s.d. 3 Maret 2021.  https://t.co/bPkGmP0aXJ"
1365573014281101314,2021-02-27,liputan6dotcom,"Cegah Covid-19, Rutan Kelas I Depok Bagi Ribuan Masker ke Warga Binaan  https://t.co/odR1rrDRLk"
1365559887212634116,2021-02-27,rudyw7,"Sugeng siang pak @ganjarpranowo saya RudyWid peserta zoom Vaksin Covid-19 Depok tadi pagi. Mau share cara rubah background video sj, siapa tau bapak jadi mau mencoba 🙂, semoga bermanfaat.  Salam sehat selalu  https://t.co/fuLlLQapiF"
1365540606827630592,2021-02-27,daffaradis,Tepat setahun yang lalu memulai proyek coffeeshop hunting with @_emmaww tapi tidak dapat berlanjut karena tiba-tiba corona ada di depok  https://t.co/L2O4Y8OnxQ
1365539804293734402,2021-02-27,humasrutandepok,"Pada kesempatan serupa, Dokter Rumah Tahanan Kelas I Depok, Imma dalam penyampaiannya memberikan arahan terkait kesehatan pada pandemi COVID-19. “Tetap selalu rajin mencuci tangan , menjaga jarak, dan gunakan masker, dan kami tidak henti-hentinya selalu mengingatkan"
1365539732680282114,2021-02-27,billy_rania,@V4r3zh_Dev @DLJ_Channel @YasmineMirzha @AirinSoekma_02 @HarryRidwan_Ay @D3wiePram3sty01 @dahgiituaja @kharimakharima1 @its_Arthur19 @k4yyona_ @Billy_Rania2222 @Febree17_ @ZSDaengMarowa @CutSarina5 @Regina_W34kley @Z4_N154 @AntonTenabank @__3TeK3weR__ Agung di Depok lagi kena covid ya 😭😭😭gw cuma ampe tamat SD yrus pindah ke Jakarta dan end up di Depok  trus gw stay di Brisbane for good y Alhamdulillah
1365539198120288256,2021-02-27,humasrutandepok,"PASTI SEHAT, RUTAN KELAS I DEPOK BAGIKAN MASKER DAN SABUN KE WBP  Dalam Rangka memutus mata rantai penyebaran Virus Covid'19 di Indonesia Khususnya Rumah Tahanan Kelas I Depok, dalam hal ini di implementasikan dengan melaksanakan Kegiatan Pembagian Masker dan Sabun di Blok Hunian  https://t.co/zPBGqqf2mV"
1365416992304287745,2021-02-27,akunbiz,"Merebaknya pandemik Corona di dunia sejak akhir tahun 2019 silam, dan juga mulai masuk di Indonesia dengan cluster pertamanya di Depok -Jawa Barat sekira bulan Maret lampau, disadari atau tidak, semua itu  https://t.co/Rm6mWVLvJx"
1365340664263630848,2021-02-26,jabarnewss,"Positif COVID-19, Begini Pelantikan Wakil Wali Kota Depok Imam Budi Hartono 👇  https://t.co/8NMQLGat5Z  #jabarnews #beritalokal #beritahiperlokal #harianjabar #jabartoday #beritajabar #beritajawabara #jawabarat #jabar #positifcovod19 #pelantikanwakilwalikotadepok #imambudihartono  https://t.co/o3n7GThHe1"
1365332069941870592,2021-02-26,astropholee,"@mer0kok ak awalnya 1 sekolah, trs pas kuliah akunya ngerantau wlpn dari maba blm ke perantauan tp karna corona dari pas kita kelas 12 taun kmrn akhirnya jarang ketemu trs rumahnya dia dk depok dan aku di jkt, jd udh bisa disebut ldr sebelum waktunya🙂👍"
1365326923254009858,2021-02-26,steven_kode289,"@akizuki_pascal Itu Maret tahun lalu  Masih inget 1 maret adalah hari dmn org Depok, kena covid-19 Hari itu lsg heboh. Pada borong masker ampe beneran langka, ga ada dijual dimana2 satu Jabodetabek. Hand sanitizer juga. Dijarah abis.  Skrg? Org sudah masabodo sama covid-19, yg mereka pikirkan..."
1365323425951096836,2021-02-26,hamzahcentre,"Masalah ini sepatutnya segera diselesaikan oleh pihak-pihak terkait, warga Depok butuh informasi valid @pemkotdepok @satgascovid19id #depok  Selisih Jumlah Pasien Covid-19 Depok Terjadi Lagi, Versi Pemerintah Pusat 89 Persen Lebih Banyak Klik untuk baca:  https://t.co/quQrFhJQ6B"
1365315450356133895,2021-02-26,idnpublic,"Kasus Aktif Corona Depok Disebut yg Tertinggi, Satgas: Data Pusat Tak Update  https://t.co/Ez567RJrmy #Terbaru #berita #liputan6 #live"
1365307900076331010,2021-02-26,kompascom,"Pemerintah Kota Depok mencatat 262 kasus baru Covid-19, 314 pasien Covid-19 pulih, serta 5 lainnya wafat.  https://t.co/GWG4FTGGcW"
1365300347309199362,2021-02-26,liputan6dotcom,"Kasus Aktif Covid-19 Depok Disebut yang Tertinggi, Satgas: Data Pusat Tak Update  https://t.co/EcQz9HxJJH"
1365295812729737225,2021-02-26,sarf50053,Kesan Imam Budi Hartono Dilantik jadi Wawali Kota Depok di Ruang Isolasi Covid-19  https://t.co/plcjH8dMIR  https://t.co/Jrw6h3vAZ5
1365290791921274890,2021-02-26,merdekadotcom,"Kesan Imam Budi Hartono Dilantik jadi Wawali Kota Depok di Ruang Isolasi Covid-19: ""Terasa asing aja sendiri ya tanpa ada protokoler yang harusnya dilakukan di Gedung Merdeka, enggak ketemu gubernur, kepala daerah yang lain, tandatangan langsung.""  https://t.co/zN21H02WjM"
1365279965617418240,2021-02-26,ahmadnormaulana,"Positif Corona, Pelantikan Wakil Wali Kota Depok Dilakukan di Ruang Isolasi  https://t.co/dCmZYybi0O"
1365254042847383555,2021-02-26,idnpublic,"Penyembuhan Corona, Wakil Wali Kota Depok Dilantik di Rumah Sakit   https://t.co/2KCFUcYmem #Terbaru #berita #IDNtimes #live"
1365222706396884993,2021-02-26,pikiran_rakyat,"Masih Dirawat karena Terpapar Covid-19, Wakil Wali Kota Depok Terpilih Dilantik di Rumah Sakit  https://t.co/MAoOxFhv27"
1365218008939982858,2021-02-26,depoknegeri,terkait Kejaksaan Negeri Depok menuju Wilayah Birokrasi Bersih Melayani (WBBM). Kegiatan tersebut tetap dilaksanakan dengan mematuhi Protokol Kesehatan Covid-19.  https://t.co/Iakw9wGyFS
1365210371661778947,2021-02-26,rtmc_diy,Personel Ditlantas Polda DIY menggelar operasi yustisi protokol kesehatan dengan sasaran pengendara yang melintas di dekan Mapolsek Depok untuk memberantas penyebaran Covid-19.  https://t.co/kfURJqI5oU
1365210136634036224,2021-02-26,kompascom,Imam Budi dilantik secara daring karena masih menjalani isolasi di RS Mitra Keluarga Depok lantaran positif Covid-19.  https://t.co/cqjVwtzc5t
1365203531750281221,2021-02-26,wartakotalive,"Pesan untuk Wali Kota Depok, Pengusaha UMKM Berharap Dapat Bantuan Modal Imbas Covid19    https://t.co/ukmHRHgGRE   #umkm #depok #Covid_19 #viruscorona     lewat @wartakotalive"
1365191391001808897,2021-02-26,liputan6dotcom,"VIDEO: Masih Positif Covid-19, Wali Kota Terpilih Depok Dilantik di Rumah Sakit  https://t.co/5Tl9eUIJpU"
1365190876884987908,2021-02-26,ahmadnormaulana,"Momen Pelantikan Terpisah Wali Kota &amp; Wakil Walkot Depok, Idris Dilantik di RS karena Covid 19  https://t.co/TfJVblUq4g"
1365186882510876683,2021-02-26,idnpublic,"Masih Dirawat karena Corona, Wakil Wali Kota Depok Imam Budi Dilantik dari RS  https://t.co/VlJbMEIOVq #Terbaru #berita #live #merdeka"
1365182333490401281,2021-02-26,terasjabar_1," https://t.co/u3lgeb1lMj  Masih Menjalani Perawatan Karena Covid-19, Wakil Wali Kota Depok Imam Budi Dilantik dari RS"
1365182089780293633,2021-02-26,kompascom,"Perbedaan jumlah pasien/kasus aktif Covid-19 kembali terjadi antara data real-time Kota Depok, Jawa Barat dengan versi Satgas Penanganan Covid-19 pusa  https://t.co/kHKXjHq3xX"
1365181073026523137,2021-02-26,ahmadnormaulana,"Masih Dirawat karena Covid-19, Wakil Wali Kota Depok Imam Budi Dilantik dari RS  https://t.co/vnWWohW0mK  https://t.co/MpBRC9Vmxp"
1365175774836256771,2021-02-26,merdekadotcom,"Masih Dirawat karena Covid-19, Wakil Wali Kota Depok Imam Budi Dilantik dari RS: Hari ini Mohammad Idris dan Imam Budi Hartono dilantik sebagai Wali Kota dan Wakil Wali Kota Depok periode 2021-2026. Keduanya dilantik bersama 4 pasangan kepala daerah…  https://t.co/gZfwYiL94d"
1365154509631016964,2021-02-26,liputan6dotcom,"Masih Positif Covid-19, Wakil Wali Kota Depok Imam Budi Hartono Dilantik di RS  https://t.co/9XxPdIe2As"
1365142427778969600,2021-02-26,kompascom,"Pemerintah Kota Depok mencatat 265 kasus baru Covid-19, 366 pasien Covid-19 pulih, serta 3 lainnya wafat.  https://t.co/nJa8s3fuzd"
1365141172402802691,2021-02-26,idnpublic,"10 Kabupaten/kota dengan kasus Corona tertinggi, Solo &amp; Depok teratas  https://t.co/JyuKyfNzDJ #Terbaru #berita #kontan #live"
1365136300345466880,2021-02-26,hamzahcentre,Semoga Covid-19 di Depok bisa cepat berkurang. Warga dan seluruh pihak terkait diharapkan saling sinergi atasi Covid💪🦅 -H. Hamzah- #depok #COVID19 #KHH   https://t.co/6fndWPV3Zr
1365123050711130112,2021-02-26,kompascom,"Pemerintah Kota Depok mengumumkan, saat ini ada 3.740 kasus aktif Covid-19 atau pasien yang sedang terpapar virus corona di daerah itu.  https://t.co/ShZxJ1FB1J"
1365122426208542722,2021-02-26,vivacoid,Depok Sebut Data COVID-19 dari Pusat Tak Akurat  https://t.co/5ayVKZ4AQ7
1365110950148202496,2021-02-26,hmmurahmurahhm2,"Wali Kota dan Wakil Wali Kota Depok Dilantik Terpisah, Idris di Bandung dan Imam di RS karena Positif Covid-19 Klik untuk baca:  https://t.co/jGUGYOxJt4"
1365018364888838146,2021-02-26,seknasjppi,Dinas Pendidikan Depok Ajukan 18.850 Tenaga Pendidik Divaksinasi Covid-19 -  https://t.co/vqwlnsfmZj  https://t.co/gSDyWpFVMM  https://t.co/z3J63qjrzk
1364968280608366594,2021-02-25,republikaonline,GTPPC Depok laporkan pasien positif Covid-19 menjadi 34.945 orang  https://t.co/nnzqlmU9CC
1364932607213858820,2021-02-25,syaaiii_,"@fathivibes bulan lalu keluarga aku ge kena covid di depok, yg negatif cuma aku 🥲"
1364919189585108992,2021-02-25,mediaserunicoid,"Vaksin Covid-19 tahap kedua sudah sampai di Gudang Farmasi Kota Depok. Vaksin Covid-19 ini akan diberikan kepada pelayan publik seperti wakil rakyat, pejabat negara, atlet, tokoh agama, pedagang pasar, guru, ASN, TNI, Polri, dan pelayan publik lainnya.    https://t.co/c62UeTSjrt  https://t.co/NowuAQbhie"
1364908000754995202,2021-02-25,pingpointid,Pemkot Depok mengumumkan santunan kematian untuk puluhan ahli waris korban wafat COVID-19 dibatalkan.  Pemkot Depok: Santunan Kematian COVID-19 untuk Keluarga Dihentikan  https://t.co/in7AKRqFD2  #SantunanCOVID19 #InfoDepok @depokita  https://t.co/o4DdIJ3MKr
1364892050496188416,2021-02-25,sajayade,"Banyak Zona Hijau COVID-19, Depok Siapkan Skema Belajar di Sekolah   #CTBot Adrop Ram 10 tatm 10   https://t.co/GZZNyAses5"
1364885840011268096,2021-02-25,bacadibabe,Depok Daftarkan 18.850 Tenaga Kependidikan untuk Vaksinasi Covid-19 #Vaksin #Virus #KotaDepok #PenerimaVaksinCovid19 #Vaksinasi  https://t.co/hPVHMyz8qq  https://t.co/ybX0sgwl4K
1364853461158797317,2021-02-25,nugrohoedhypur4,"@jokowi Giliran kita masyarakat biasa yg di Depok blm ya pak presiden, dari mulai awal covid sampai saat ini blm menerima bansos apalagi vaksin..tdk tau salahnya dimana sbg warga negara yg punya e-KTP resmi di Kecamatan Pancoran mas 🙏."
1364851760586579970,2021-02-25,liputan6dotcom,Dinas Pendidikan Depok Ajukan 18.850 Tenaga Pendidik Divaksinasi Covid-19  https://t.co/Y9YbB6pai4
1364844716144037891,2021-02-25,tanyasimi," https://t.co/Nr6zK0wLNy  Positif Corona, Imam akan Dilantik Jadi Wakil Wali Kota Depok secara Virtual: Setelah sempat tertunda, akhirnya pelantikan Wali Kota dan Wakil Wali Kota Depok periode 2021-2026 segera digelar. Pelantikan akan dilakukan pada Jumat… Sumber merdeka com  https://t.co/CqhK6JpH3j"
1364842329937309701,2021-02-25,liputan6dotcom,Vaksinasi Covid-19 Tahap Kedua di Kota Depok Terkendala Jarum Suntik  https://t.co/spizmkHJCs
1364837299637248002,2021-02-25,vivacoid,"Banyak Zona Hijau COVID-19, Depok Siapkan Skema Belajar di Sekolah  https://t.co/Xl2hG22l8c"
1364837078362558471,2021-02-25,ahmadnormaulana,"Banyak Zona Hijau COVID-19, Depok Siapkan Skema Belajar di Sekolah  https://t.co/n04EZrwGLU  https://t.co/hHhMk1Firm"
1364834416468525056,2021-02-25,ahmadnormaulana,"Positif Corona, Imam akan Dilantik Jadi Wakil Wali Kota Depok secara Virtual  https://t.co/vf2sdVyQeD  https://t.co/56zxTNGUKS"
1364833142675107844,2021-02-25,merdekadotcom,"Positif Corona, Imam akan Dilantik Jadi Wakil Wali Kota Depok secara Virtual: Setelah sempat tertunda, akhirnya pelantikan Wali Kota dan Wakil Wali Kota Depok periode 2021-2026 segera digelar. Pelantikan akan dilakukan pada Jumat (26/2) di Bandung oleh…  https://t.co/4tguHTn9v9"
1364818794573688835,2021-02-25,rspuricinere,Kegiatan Onsite Test Covid-19 Swab Rapid Antigen 25 Februari 2021 PT. Ahara Bhadranaya Indonesia  #swabantigen #screningkesehatan #coronavirus #covid #rspuricinere #rspc #cinere #depok  https://t.co/v4rkU3OKsa
1364811238312710144,2021-02-25,zerriath,"Percepat penanganan Covid-19, Babinsa Manahan Laksanakan Kegiatan PPKM di Pasar Burung Depok  https://t.co/dIA60RIbdM"
1364807847385554947,2021-02-25,merdekadotcom,"18.850 Guru Depok Didata untuk Vaksin, Juli Diharap Bisa Belajar Tatap Muka: Sebanyak 18.850 tenaga pendidikan di Depok sudah didaftarkan sebagai penerima vaksin Covid-19. Data tersebut telah diserahkan Dinas Pendidikan Kota Depok ke Dinas Kesehatan Kota…  https://t.co/yEEXYDM9ar"
1364802185318440960,2021-02-25,vivacoid,18.850 Tenaga Pendidik di Depok Segera Divaksin COVID-19  https://t.co/dsCW4xIRRT
1364779149278253057,2021-02-25,korantempo,"Keterlibatan politikus PDI Perjuangan, Ihsan Yunus, dalam kasus dugaan korupsi bantuan sosial Covid-19 di daerah Jakarta, Bogor, Depok, Tangerang, dan Bekasi semakin terang benderang.  #korantempodigital #KoranTempo  https://t.co/UdZFoWHa2a"
1364775257576529923,2021-02-25,fmasriati,"Nah kasih tahu presiden lu terapin protokol kesehatan jika menurut lu kenyataanya ada covid di Indonesia. Thank you, salam buat Depok."
1364774697771147274,2021-02-25,depokinfo_,#News: Ini Dasar Dinsos Tak Lagi Cairkan Santunan Kematian Bagi Ahli Waris yang Meninggal Karena Covid-19  https://t.co/dtNIpFFJA8 | Depok News
1364774691320303625,2021-02-25,depokinfo_,"#News: Putus Mata Rantai Covid-19, Tati Rachmawati Gelar Rapid Test di Polsek Limo  https://t.co/3UoDjZgKQf | Depok News"
1364767985882206213,2021-02-25,trrn_nightowl,"Hola. Aku sekarang jual kopi susu, namanya Impostor Coffee. Berlokasi di Mekarsari, Depok. Akhirnya setelah 3 bulan rencanain buat usaha, kesampean juga diwaktu yang tidak disangka karena covid. Ohya, harganya 18k aja.  https://t.co/p7KHp5MU1W"
1364767183541215232,2021-02-25,ddystbd90,@pemkotdepok mohon informasi faskes yang melakukan vaksin covid 19 di depok?
1364762384200388617,2021-02-25,wonderbeom,"HELP RT PLEASE⚠  URGENTLY NEEDED dibutuhkan donor darah A+ dari orang yang sudah sembuh dari covid-19 dom depok jika berkenan dan memenuhi kriteria bisa langsung dm ig temen saya, terimakasih 🙏🙏  https://t.co/VRhEpGsRj2"
1364729361845407745,2021-02-25,depokinfo_,"#News: Covid-19 Meningkat, Pokdarwis Kali Baru Tutup Sementara Situ Cilodong  https://t.co/bc0CHQgwQ8 | Depok News"
1364720336336396290,2021-02-25,miredodino,"Bogor, pas yg kena corona baru 1 orang depok. Maret gitu."
1364717882047782921,2021-02-25,kompascom,"Jumlah kasus aktif Covid-19 di Depok kembali meningkat, yaitu bertambah 96 dibandingkan sehari sebelumnya menjadi 3.844 pasien.  https://t.co/BmmgYPKyJs"
1364578244117159936,2021-02-24,beritaasatu_com,Himasal Depok- Bogor: Disiplin Prokes dan Jalani Vaksinasi Covid-19 Demi Indonesia  https://t.co/v0LDYBz0HL
1364578209900032003,2021-02-24,beritaa1,Himasal Depok- Bogor: Disiplin Prokes dan Jalani Vaksinasi Covid-19 Demi Indonesia  https://t.co/ZQEYcFdjwR
1364576277156438016,2021-02-24,beritaa1,"Himasal Depok-Bogor : Sukseskan Vaksinasi Covid-19, Semoga Pengasuh Pesantren Juga Diprioritaskan  https://t.co/UyGhBgl9he"
1364575980166156288,2021-02-24,tribunrakyat,Himasal Depok-Bogor : Kami Berharap Pengasuh Pesantren Dapatkan Prioritas Vaksinasi Covid-19  https://t.co/0rpL0aWcvD
1364570532784394241,2021-02-24,timurdepok,Tim Binev Capacity Building Korbinmas Baharkam Mabes Polri melakukan kunjungan ke Posko PPKM Mikro penangangan Covid 19 di wilayah Kalurahan Condongcatur dan Kalurahan Maguwoharjo Depok Sleman D.I Yogyakarta.   https://t.co/kVusnd42gG    https://t.co/w1x89dKfBD  #ppkmmikro  https://t.co/o6c8XV4eAE
1364566817516130304,2021-02-24,republikaonline,"Pasien sembuh Covid-19 di Depok menjadi 30.123 orang atau 86, 86 persen  https://t.co/JmaGenSpz8"
1364558738250637314,2021-02-24,depoknegeri,"Kepala Kejaksaan Negeri Depok, Sri Kuncoro, S.H.,  https://t.co/ZmsppHe22L. Menghadiri acara Penandatanganan Perpanjangan PKS dan Penyerahan Piagam Penghargaan antara PDAM Tirta Asta Depok yang di selenggarakan di Kantor Kejaksaan Negeri Depok dengan menerapkan Protokol Covid-19.  https://t.co/Pi8Zw5ZeBb"
1364557807001903107,2021-02-24,mediaserunicoid,"Ketua Fraksi PKB dan PSI DPRD Depok Tati Rachmawati gelar rapid test bersama anggota Polsek Limo, di Kampung Tangguh Covid-19 di Kelurahan Jati Baru, Kecamatan Limo, Depok, Jawa Barat.  Baca Berita Selengkapnya di  https://t.co/G2uS70613p !!    https://t.co/Vf4bMONTUn  https://t.co/Rzo6XagP8G"
1364544738888589315,2021-02-24,liputan6dotcom,Wakil Wali Kota Depok Terpilih Imam Budi Hartono Masih Positif Covid-19  https://t.co/KCFigBESYY
1364544073403559938,2021-02-24,pemkotdepok,Penerimaan Vaksin Covid-19 Tahap 2 di Kota Depok  https://t.co/FTiTj4Idx8
1364512068070744065,2021-02-24,beritaedisi,Kenaikan Kasus Baru Covid-19 di Depok dan Pahami Gejalanya  https://t.co/3oc81SmSmC @info_depok  @kominfodepok
1364495382902792194,2021-02-24,to_hoshiwonwoo,"@lavenderforgyu iyaa gatau jg ini corona ga kelar2 heran bgt 😭 aku dom depok kak 😂 aku yg kudet atau apa tp ga pernah liat bday event di depok 🙂 tp biasanya paling di jkt semua event2 gt nah kl jogja aku pernah liat tp ga bnyk setauku, pdhl kalo jkt ada pasti gemes 😢"
1364485936508112901,2021-02-24,poskotaofficial,"Kampung Tangguh Jaya, Depok Dinilai Berhasil Tekan Laju Penyebaran Covid-19 #Pandemi #Depok #COVID19  Baca Selengkapnya :   https://t.co/tl7LN5l8Cs"
1364391962556596225,2021-02-24,pemkotdepok,3.614 RT di Depok Masuk Zona Hijau Covid-19  https://t.co/8CV8wfoLt4
1364373460235874304,2021-02-24,depoknegeri,"Kepala Kejaksaan Negeri Depok, Sri Kuncoro, S.H.,  https://t.co/ZmsppHe22L. Menghadiri acara Upacara Pembukaan Lomba-Lomba Pendidikan Kota Depok Tahun 2021 yang di selenggarakan di Sekolah Cakra Buana dengan tetap menerapkan Protokol Covid-19.  https://t.co/1UBymO0Wn5"
1364373067925909506,2021-02-24,depoknegeri,"Kepala Kejaksaan Negeri Depok, Sri Kuncoro, S.H.,  https://t.co/ZmsppHe22L. Melakukan kegiatan Penandatanganan Perpanjangan Perjanjian Kerja Sama dengan BPJS Ketenagakerjaan kota Depok  yang di selenggarakan di Hotel Margo Depok dengan tetap menerapkan Protokol Covid-19.  https://t.co/HPhwnjS7xw"
1364364690965491712,2021-02-24,kompascom,kaJumlah sus aktif Covid-19 (yaitu orang yang sedang dirawat atau menjalani isolasi mandiri) di Depok mencapai 3.748 pasien.  https://t.co/SM1u7KWb1K
1364231062109507584,2021-02-23,infodepok_id,"Kepala Dinas Lingkungan Hidup dan Kebersihan (DLHK) Kota Depok Ety Suryahati menegaskan, operasional taman kelurahan belum akan dibuka dalam waktu dekat. Hal ini dilakukan untuk memutus rantai penyebaran Covid-19.  “Kalau waktu dekat, belum ada rencana (…  https://t.co/ErX13MQAOs  https://t.co/bZpsksZ9t4"
1364194670817910797,2021-02-23,taufansd,"@firdzaradiany mas gugus covid Depok yang respon punya kontaknya, teman dan istrinya Positif Covid, sementara kondisi udah batuk dan sesak, terimakasih"
1364174537378603009,2021-02-23,siarandepok,317 Kasus Baru Covid-19 di Kota Depok.   https://t.co/QvrFSSFXKL
1364159206916378626,2021-02-23,setyo_stefanus,Yuuk kita tanya jawaab lagi sama murid 😁........ #covid_19 #covid #tiktok #smk #smkbroadcast #smkghamacarakadepok @ Depok  https://t.co/odIshBYm5E
1364152219449233408,2021-02-23,spotsketsa,"Zona Hijau COVID-19 di Depok Bertambah, Total Ada 3.641 RT   https://t.co/miHioh9xLP  https://t.co/mMZ3xWp3Fs"
1364131270117060617,2021-02-23,vivacoid,"Zona Hijau COVID-19 di Depok Bertambah, Total Ada 3.641 RT  https://t.co/5XAnnx2eFf"
1364125273042509824,2021-02-23,antara_jabar,Zona hijau COVID-19 di Kota Depok bertambah 135 RT - ANTARA News Jawa Barat  https://t.co/D1a4jmlQPB
1364124596299915265,2021-02-23,merdekadotcom,"3.641 RT di Depok Kini Masuk Zona Hijau Covid-19: ""Terjadi penurunan RT Zona Kuning sebanyak 127,"" paparnya.  https://t.co/n6OXHX120m"
1364113046679941121,2021-02-23,voidotid,Zona Hijau COVID-19 di Depok Bertambah 135 RT  https://t.co/kGsuITXsPn
1364003175464771585,2021-02-23,rafiandratfr,Ada yang punya info vaksinasi COVID-19 lansia di Depok?
1363996078173917191,2021-02-23,mhilmi_setiawan,@pemkotdepok maaf mau tanya lokasi Vaksinasi Covid-19 untuk wilayah Kota Depok dimana ya? Saya sudah dapat nomor tiket untuk kategori jurnalis/wartawan
1363988710400794624,2021-02-23,kompascom,"Pemerintah Kota Depok mencatat 144 kasus baru Covid-19, 331 pasien Covid-19 pulih, dan 6 pasien Covid-19 meninggal, kemarin.  https://t.co/laNIr7q6WR"
1363897635581566981,2021-02-23,julizhanti,"Dpt tpt di UMKM GIANT BBM TOLE ISKANDAR DEPOK di saat Pandemi Corona, tetep Optimis tuk dpt uang recehan tuk bayar air, listrik, beli kuata HP Alhamdulillah, Dinas UMKM sdh sangat membantu  #jualan pempek, siomay punya mba q yg super eunak  Pak @IdrisAShomad  Ibu @fahiraidris  https://t.co/ZNGu2YvQny"
1363887417640374275,2021-02-22,rioprosetara,@Sofy_Beeeeee maksudnya si anies lbh rendah moralnya  1. ada covid pura2 kena covid sampe dikarantina 1 bln itu jg krn ada risma diangkat mentri blusukan di dki membuat anies lupakan covidnya 2. ada banjir menghilang lama trus cuma konpres basa basi banjir dki itu kiriman di bogor dan depok
1363820718895501313,2021-02-22,mustofa26384913,😂😂😂 tahun 2020 anies pake tameng covid ...tahun 2021 anies tameng nya kiriman bogor depok Tangerang
1363736558050758657,2021-02-22,faqinihbos,"@mlbbfess Depok kota awal dari semua awal,korona dr depok, begal depok, gengster depok wkwkwk canda depok"
1363733642363564038,2021-02-22,kurniyawan_23,@pemkotdepok utk wilayah depok pembagian zona mengenai covid dapat di akses dimana ya min?
1363704863452880902,2021-02-22,koramil12mlati,Pada perpanjangan pelaksanaan Pemberlakuan Pembatasan Kegiatan Masyarakat Mikro saat ini masih terjadi di Kapenewon Depok Kab. Sleman warga yang dinyatakan positif dan meninggal dunia kemudian dimakamkan secara protokol Covid 19. Selasa (22/02/2021).  https://t.co/yeXm33V2K0
1363687524204445696,2021-02-22,depokinfo_,"#News: Masyarakat Terdampak Covid-19 Meningkat, Nur Azizah Dorong Pemkot Bekasi Perbaiki DTKS  https://t.co/KVyi32pppz | Depok News"
1363676572499070977,2021-02-22,humaspanmaspol1,Giat Opresai Yustisi diwilayah Hukum Polsek Pancoran mas dan pembagian Masker kepada warga masyarakat pengguna jalan # putus penyebaran covid 19 diwilayah depok  https://t.co/kynKjlSDiI
1363624426638483458,2021-02-22,kompascom,"Kini kasus aktif Covid-19 di Depok mencapai 4.000 pasien, bertambah 81 dibandingkan kemarin.  https://t.co/oLorpjuqqz"
1363568110750498817,2021-02-22,jhonamerah,Cek Fakta: Virus Corona Disebut Hanya Fitnah dari Elite Global agar Hambat Kebangkitan Umat Islam - Pikiran Rakyat Depok  https://t.co/NFOLOTO7ND
1363527946913206277,2021-02-21,66wine,"@Corona_KafirNw Anies yg banjir jkt, yg diserang bogor sm depok Pekok nih prof.... Kalo ngomong yg berimbang lah..m"
1363510370615185411,2021-02-21,dianaluvjc,"Yang begini ini loh aneh.. Jabar tuh kasus covid penyumbang banyak Depok, bogor,bekasi. Tapi malah yg pertama vaksin yg lansia, Bandung @PemprovJabar @KemenkesRI @BudiGSadikin"
1363491008407724034,2021-02-21,yaneduard12,"Kunjungan Ke Panti Asuhan st.Fransiskus Depok. Puji Tuhan mereka semua telah pulih, setelah positif terpapar covid 19.  https://t.co/G3ynyRyYdR"
1363458726204608517,2021-02-21,denisasywlk,"@IlhamGymnasti12 Wkwkwkw Depok trs,covid kiriman Depok,banjir kiriman Depok"
1363437585696256006,2021-02-21,polsekgajahmgkr,"Kapolri Jenderal Polisi Drs. Listyo Sigit Prabowo,  https://t.co/rkCZwOZuQx., menerapkan protokol kesehatan mengukur suhu tubuh sebelum melakukan peninjauan Posko PPKM Mikro Covid-19 yang terletak di Kelurahan Maguwoharjo, Kecamatan Depok, Kabupaten Sleman, Jumat (19/2).  https://t.co/ykIdXJUn0H"
1363393197045551104,2021-02-21,chandri0603,@Billy_Rania @PelatihMolor Btw depok mmng seperti tak ada covid.
1363298620125061120,2021-02-21,dianaluvjc,"@dokterMade @Bagasta8 @ProfesorZubairi @DokterPodcast @dirgarambe @drpriono1 @tirta_hudhi @ferdiriva @febrinasugianto @afrkml Sedangkan bekasi, depok yg kena covid lebih banyak daripada bandung"
1363298344362143744,2021-02-21,billy_rania,"Assalamualaikum lur semua minta Infonya dah H 4 blm ada satgas COVID-19 dtg rmh  Nyokap gw di Depok ada yg tau prosedurnya utk org2 yg dah kena COVID-19 gg , gmn dgn obat2 nya soalnya makanan gg kuatir HELP ME PLS😭😭😭😭😭😭😭😭😭😭😭😭😭😭😭😭😭😭😭"
1363288771555254272,2021-02-21,pakcah,"Narasumber :   1.Sri Rahmi (Makassar), penulis buku “Tahun Corona”   2.Wiwik Adzkiya (Depok), penulis buku “Anak Payung”   3.Carolina Destika (Pekalongan), penulis buku “Alunan Tempias Iman”  https://t.co/OMj5Wbxltv"
1363122045123395587,2021-02-20,venicebeige,"halo guys di sini ada yang pernah terpapar covid atau kenal sama orang yang pernah terpapar covid (domisili grogol, depok)? kalau punya kenalan boleh guys hit me up😁"
1363115722516271108,2021-02-20,wandaftr,"Di Jawa Timur pun nenek tinggal sendirian, hampir 1 tahun tinggal di depok karena wabah covid-19. Kemarin pulang kampung karena mbah uyut meninggal."
